id,title,release_date,overview,vote_average,vote_count,popularity,original_language
328811,"Classic Cartoon Favorites, Vol. 2 - Starring Donald",2005-01-11,"Don't miss the world's most lovable cranky duck in this must-have collection of Donald's greatest cartoon shorts.  Each hilarious adventure is filled with the irresistible antics that have made Donald a fan favorite for generations.  Laugh along with ""Chef Donald"" as the irritable duck accidentally mixes rubber cement in with his waffle batter to create a very sticky situation, and catch the first appearance of Daisy Duck as Donna in the hysterical ""Don Donald.""  Get in on the fun with the cartoon collection of Donald's funniest moments - it's great entertainment for the whole family!  Over An Hour Of Fun: Inferior Decorator (1948) / Don Donald (1937) / Golden Eggs (1941) / Bee at the Beach (1950) / Donald's Dog Laundry (1940) / Donald's Vacation (1940) / Old MacDonald Duck (1941) / Chef Donald (1941)",9.3,3,0.0648,en
542067,Hydrangea,2017-08-26,"In life we often play a role, be that a parent, a spouse, an employee, etc. Writer/director Jim Cummings explores the dynamics between playing a part and being real in this short film about an idealized family.",6.9,7,0.0742,en
18169,About Last Night...,1986-07-02,"A man and woman meet and try to have a romantic affair, despite their personal problems and the interference of their disapproving friends.",6.03,220,1.0685,en
412327,Isidoro: la película,2007-07-19,"Isidoro is a lazy guy, who loves parties and casinos, but has never worked, so he lives off his father's inheritance and making his uncle suffer. But because his uncle, Colonel Cañones, is accused of a crime against the nation, Isidoro must work for the first time in his life to find the true culprit.",6.8,18,0.1547,es
42189,Kevin Hart: Seriously Funny,2010-07-20,"Fresh off the heels of appearing in movies like Superhero Movie and The 40 Year-Old Virgin, fast-talking comedian Kevin Hart stars in his second live stand-up performance in Cleveland, Ohio, where he makes fun of everything and everybody - especially himself.",7.033,166,0.4589,en
49363,Samurai Banners,1969-03-01,"Kansuke Yamamoto is a samurai who dreams of a country united, peaceful from sea to sea. He enters the service of Takeda, the lord of Kai domain. He convinces Takeda to kill the lord of neighboring Suwa and take his wife as a concubine. He then convinces the widow, Princess Yu, to accept this arrangement and to bear Takeda a son. He pledges them his life. He then spends years using treachery, poetic sensibility, military and political strategy to expand Takeda's realm, advance the claim of Yu's son as the heir, and prepare for an ultimate battle with the forces of Echigo. Has Kansuke overreached? Are his dreams, blinded by love, too big?",7.5,19,0.5491,ja
986549,The Untouchables: Production Stories,2004-10-05,"Cast and crew from ""The Untouchables"" share production stories.",6.5,2,0.1842,en
427014,El telo y la tele,1985-04-18,"A sex congress takes place in a hotel, and couples are secretely filmed in a Slivers way by the ""scientists"".",3.0,3,0.1295,es
366955,Explosion en mer,1898-02-22,,7.0,2,0.0438,fr
216677,Joomoonjin,2010-01-21,"A magical love story involving a man who lives his life like a ghost and a country girl that falls in love with him.  On a rural mountain in Jumunjin, South Korea a girl named Jina (Hwang Bo-Ra) runs a mountain lodge. The place is soon set to close down because of rumors that ghosts live in the lodge. Jina then encounters a ghost (played by Kim Ki-Bum) who she takes an interest in. But, the closer she gets to help him the further the ghost pushes her away.",6.0,3,0.14,ko
769928,"Hakata Station in Japan - Highspeed, Luxus, Hoeflichkeit",2020-11-13,,10.0,1,0.0,de
618516,Those of the Treetops and Heaven,2015-03-26,"A young boy, living in a village on a giant tree, falls into the depths of the forest where he meets two indigenous beings who will help him return home.",7.4,4,0.0453,fr
242070,Heroes of the Alamo,1937-08-07,"In early spring of 1833, the smoldering resentment of American settlers in Texas against their oppression by Mexico dictator General Santa Anna/Ana coming to a head. When a decree is issued that no more Americans may enter Texas, William H. Wharton, fiery head of a faction determined on independence or nothing, warns Stephen F. Austin that the time for half-measures is past. Austin, responsible for bringing the Americans to Texas as colonists, reminds Wharton that a settler's revolt against Mexico would dishonor his name and the arrangements he had with the Mexican government. He gets the ""Whartonites"" to agree to a general convention of all colonists. Almerian Dickinson, biggest land owner in the settlement of Gonzales, deeply in love with his wife Anne, warns Wharton that a bloody revolt would endanger every wife and mother in the colony. He proposes they send Austin to Mexico City to ask Santa Anna to grant Texans a voice in their own government.",3.5,2,0.2515,en
71316,Nutcracker: The Motion Picture,1986-11-26,"In this Pacific Northwest Ballet performance, it is Christmas Eve and festivities are underway. Clara is excited when her godfather arrives with a bag full of gifts, one of which is an intriguing wooden nutcracker. That night, while the household sleeps, Clara visits the Christmas tree to inspect her nutcracker and soon finds herself immersed in a dream world both dark and enchanting.",6.5,20,0.6104,en
48361,Golgo 13: Assignment Kowloon,1977-09-15,"Duke Togo (codename: Golgo 13) is a ruthless assassin who's accepted a tricky assignment from an American drug syndicate. His mission is to ""rub out"" Hong Kong's underworld kingpin. His main obstacle is the relentless Detective 'Smitty' Smith, determined to stop Togo no matter the cost. The result is an explosive adventure through the seamy, violent streets of Hong Kong.",5.4,24,0.7357,ja
337904,Οι Γαμπροί της Ευτυχίας,2015-01-15,"Vangelis is a traditional Cretan family man, married to Lina. Unfortunately, he can not enjoy his wife in his own house, having with them the eccentric spinster sister, Happiness.",6.1,4,0.0702,el
419019,Sleepwalk,2000-03-10,At loose ends drifter stumbles upon a struggling painter as he searches for answers under the stars and rooftops of New York.,1.0,1,0.2268,en
533666,School of the Future,2016-09-14,Researchers and educators highlight the gaps in the U.S. education system and share their visions for innovative and meaningful learning environments.,7.0,1,0.047,en
303600,"Träum’ nicht, Annette!",1949-02-04,,4.3,3,0.0586,de
355538,Ex-Cop,1993-08-12,"Pete Danberg is a good cop with a drinking problem. When the new Sheriff fires him in an effort to clean up the image of the department, Danberg refuses to give up his search until the ""Las Vegas Slasher"" is behind bars. But the slasher is paroled within a year & then sets out to make up for lost time. Hunting like a crazed animal, he uses Danberg's daughter Tess as bait to lure her father from hiding.",3.5,2,0.131,en
33733,One More Time,1970-05-01,London nightclub buddies Salt and Pepper link Pepper's dead twin to diamond smugglers.,4.3,11,0.201,en
564324,Il ragazzo che sapeva amare,1967-01-01,"Vittorio is a photographer; Roberto, the waiter; Brigitta, the operator; Pannunzio, the porter; Patty, a gold-eyed waitress. All of them live and work at the Europe Palace Hotel in Capri.",4.5,2,0.1672,it
637112,Panodrama,2019-02-23,"Tommy Robinson goes on the offensive by documenting how his own “hit piece” on his character was being constructed by the taxpayer-funded BBC for their popular investigative news special “Panorama.”  In the film he manages to capture footage of the blackmailing of his former employees to invent stories, along with an organization—known as “Hope not Hate”—on set with the BBC, intimidating ex-employees of Robinson during interviews. The host of “Panorama” at the time of filming is caught on camera casually using racist and homophobic slurs during a £220 champagne lunch with the same ex-employee they had planned to coach for a fake interview in which the BBC would possibly edit in which to make it appear as, “a gender, a sexual thing against Tommy Robinson,” according to the host.  Within 24 hours of releasing the film, social media giant Facebook made a public statement of their own and removed Tommy Robinson’s accounts permanently.",9.3,3,0.139,en
952020,Slam,2023-06-22,"Samuca is only 17 years old and discovers that his girlfriend Alicia is pregnant. The news comes to light at a not very favorable moment in Samuca's life, just when he thought everything was going very well. For having committed the same ""slam"" as his mother Melina, having a son at the same age as she had him, Samuca feels pressured. Themes such as teenage pregnancy and questions about life gain visibility and are unfolded throughout the plot.",8.0,1,0.2888,pt
506404,Chad's Dental Nightmare,2017-10-31,"Teenagers are dying in their sleep, apparently from fright, the night before they have dentist appointments. A young teen elicits the help of his older brother to help him investigate the deaths, but soon find themselves in deep peril at the hands of a mad doctor and dentist.",4.0,1,0.0143,en
90188,The Sad Life Of Gloria S.,2011-12-01,"Charlotte is a moderately successful film director who wants to make a political film, and really dive deep into the lives of socially disadvantaged women. There she makes the search for a single parent Hartz IV recipient and meets Gloria S. Gloria is her dream cast, but she doesn't know that Gloria is a real actress. Everything goes smoothly until the whole hoax blows up ...",3.5,2,0.0962,de
37109,The Shouting Men,2010-03-05,"Lowly Gillingham Football Club are drawn against Premiership giants Newcastle United in the quarter finals of the FA Cup. A small group of 'Gills' fans decide to make the most of their 'game of a lifetime' by turning the journey north into a weekend away. On the eve of departure one of the group receives a visit from Terry, a man with no legs in a wheelchair, claiming he can get them a free minibus and free diesel. In return, all they have to do is take him with them!",6.0,5,0.2419,en
153386,Sonny and Jed,1972-08-11,"As thoroughly unlikeable a robber as ever walked the West, Joe nonetheless robs from the rich and gives to the poor. Not only is he a murderous, ill-tempered sort, he is bad-mannered, too. When beautiful Sonny decides he should be her man and teach her how to be a proper outlaw, sparks fly.",5.9,11,0.3438,it
351744,Camera Phone 2,2016-04-08,"There is a package with 4 phones, and each phone has a video on it. They will then learn curiosity did kill, when their lives become a part of the terror which is ""Camera Phone 2"".",1.0,2,0.1404,en
132482,Steaming,1985-05-22,Steaming is the final film directed by Joseph Losey. It was adapted from Nell Dunn's play by Patricia Losey and Nell Dunn. It is about three women who meet regularly in a steam room and decide to fight its closure.,5.4,11,0.2951,en
649144,Empire City,1985-07-01,"A film essay contrasting the modern metropolis with its ""golden age"" from 1830-1930, with the participation of some of New York's leading political and cultural figures. Made at a time when the city was experiencing unprecedented real estate development on the one hand and unforeseen displacement of population and deterioration on the other. Empire City is the story of two New Yorks. The film explores the precarious coexistence of the service-based midtown Manhattan corporate headquarters with the peripheral New York of undereducated minorities living in increasing alienation.",9.0,1,0.3382,en
234497,Frog's Legs,1962-01-01,"Tubby enlists Little Lulu's help in catching frogs, but he doesn't tell her that he wants to sell them to a restaurant.",7.0,1,0.0071,en
383244,"Meral, My Girl",2016-02-20,"Following an accident, Meral returns to live with her traditional parents where she is confined to her bed while recuperating. Nobody confronts her condition except herself. Her little sister Asiye is her biggest supporter.",5.5,2,0.0239,de
430035,Unearthed & Untold: The Path to Pet Sematary,2017-01-13,"This documentary is a detailed look into the making of PET SEMATARY, one of the most enduring cult-horror classics of our generation.",6.7,31,0.6111,en
961614,Calling Sahasra,2023-12-01,Cyber expert Ajay joins new job but past tragedy motivates avenging crimes on women using RESQ app anonymously. Mass calls draw him into murder case amidst rescuing women.,7.0,1,0.4383,te
20098,The Wiggles: Cold Spaghetti Western,2004-03-29,"The Wiggles, in cowboy gear, visit the town fair and meet the Mariachi family.",5.0,2,0.0967,en
52961,That's Life!,1986-10-10,A wealthy architect struggles with a severe case of male menopause at the approach of his 60th birthday.,5.6,25,0.5699,en
177437,Beauty and the Breast,2012-10-05,"A first time documentary filmmaker offers a compelling insight into a devastating reality of breast cancer, as seen through the eyes of several female patients helping demystify the disease while painting poignant and often humorous intimate portraits of survival.",4.5,4,0.0702,en
646542,Coven,2020-07-14,Five undergrad witches come together in order to perform a ritual to invoke the ancient powers of the witch Ashura.,5.058,26,0.3083,en
29364,Nossa Vida Não Cabe Num Opala,2008-08-15,The father of a family of lower middle class of São Paulo dies. But he did not realize this and starts to watch the reactions of his children and the collapse of the fragile family structure. Based on a novel of Mário Bortolotto.,5.0,3,0.067,pt
383055,The Praying Mantis,1988-01-01,"A cicada is resting high on a tree. It is chirping for all it’s worth and drinking in the dew, oblivious of a mantis behind. The mantis, bending over and arching up its front leg, is going to catch the cicada but does not know that there is an oriole beside it. The bird has stretched out its neck, ready to peck at the mantis. Again the oriole is unaware that a weasel is sneaking up to it. The three creatures all covet gains ahead without being aware of an imminent danger behind.",10.0,1,0.0652,zh
468164,The Bride of Fire,2000-02-01,"A tragedy in which a young woman from an Arab tribe, prevented from marrying her non-Arab Persian lover is forced against her wishes to marry her cousin.",5.2,4,0.0745,fa
274511,Bob Wilson's Life & Death of Marina Abramovic,2012-09-12,This hourlong semi-documentary records the musical stage collaboration between director Robert Wilson and veteran performance artist Marina Abramovic. Also included is a wealth of background material about Abramovic's life and earlier works.,6.5,4,0.1963,en
102052,Cinematic Titanic: War of the Insects,2011-12-02,"The bugs shall inherit the earth!  Or so says Annabelle, the hottest, the sexiest, and by far the craziest psycho blonde chick to hit Japan since WWII. Deeply embittered about the whole man's-inhumanity-to-man thing, she enacts a diabolical plot to unleash a swarm of mutant insects on the world that will destroy all living creatures except creepy crawlers.  Ensnared in all this madness is a philandering island-hopping bug collector and his compliant and slightly pregnant wife, a humorless doctor from the mainland, and a United States airman named Charlie, whose way of starting a conversation is to hysterically scream ""Genocide!"" and then go off his rocker like the dedicated military professional he is.  If you want to watch a story where everybody gets their nuclear holocaust on in the grand tradition of radioactive Japanese monster movies, this is the film for you!",5.5,2,0.1116,en
610034,Half-Life,2011-05-05,"Searching for an escape from an impoverished city life, a retired couple moves to an abandoned country house in the radioactive zone of Chernobyl. Twenty five years after the disaster, the husband is convinced the land is ready to be cultivated, his wife on the other hand is less sure. A fable of love, Half-Life explores the boundaries of commitment and fear.",6.0,1,0.0143,en
619292,The Four Devils,1920-11-01,"One out of three silent adaptations of the novella ""Les quatre diables"" written by Danish author Herman Bang. The most famous one, although unfortunately lost, is without any doubt F.W. Murnau's ""4 Devils"". This German version, by Danish director A.W. Sandberg, was done eight years prior to Murnau's American one, and was a big success at the time.",6.0,2,0.0596,de
677903,Los hijos del odio,2003-01-01,Mexican feature film,5.0,2,0.0338,es
579542,Book Snatchers,2004-03-25,"An amazing story about the life of a modern girl and her friends, the same desperate young people who do not want to put up with the gray routine and boredom, eager to escape from the real world into the world of their dreams and fantasies.",5.5,2,0.0946,ru
601298,Not a Ladies' Man,1942-05-14,A recently divorced district attorney falls for his troubled son's schoolteacher.,6.0,2,0.1511,en
362870,Valley,2014-03-10,"This is the story of three sensitive teens who are forced to deal with violence at home, violence at school. It is a story of friendship, of love and hate, where the adolescents world is revealed as cruel and beautiful, a world where the desire to die or kill and the will to live are very confused but finally define the fate of the three heroes.",8.2,2,0.154,he
306541,Tordenskjold gaar i Land,1942-03-27,,5.0,2,0.0974,da
25279,Earth: The Power of the Planet,2007-11-20,"Dr Iain Stewart tells the story of how Earth works and how, over the course of 4.6 billion years, it came to be the remarkable place it is today.",7.9,25,0.2324,en
518861,Millennium 2000: An Expose of Americas Illuminati - Anthony J. Hilder,1998-04-18,"The ""demonic design"" of the US capital, set in stone was laid out by Master Masons in the shape of the ILLUMINATI (Luciferian) PYRAMID. Early on, these WARLOCKS OF WASHINGTON plotted to place their Satanic Symbols into the foundations of our society and gain control over America's banking system. The American public knows next to nothing about ""those"" shadowy Faustian figures who run and ruin this now Naziized Nation from the corporate boardrooms of the Major Banking Institutions. America today has essentially a ONE PARTY SYSTEM run by and for the benefit and pleasure of the International Banksters, who are sucking away the very sustenance of this once great nation. Their goal is to establish a ONE WORLD GOVERNMENT upon the ashes of American sovereignty. Adolf Hitler wrote THE NEW WORLD ORDER. What's more frightening is that the political pimps and parasites along the Potomac who are doing the bankers' bidding are attempting to install it upon the wreckage of America.",10.0,1,0.0429,en
268735,A Very Social Secretary,2005-10-10,Bernard Hill and Victoria Hamilton star in Alistair Beaton's wickedly funny feature-length drama inspired by David Blunkett's private affair held up for very public scrutiny.,6.1,7,0.2632,en
526937,From China with Love,1998-10-09,,2.0,1,0.1189,de
945770,In Search of Charlie Chan,2006-06-20,A documentary on the creation of the popular Charlie Chan detective character as well as the history of Chan films of the 1930s.,7.0,1,0.0357,en
11135,The Rescuers Down Under,1990-11-16,"A lawless poacher wants to capture a majestic and rare golden eagle, so he kidnaps the boy who knows where to find the bird. Not to worry -- the Rescue Aid Society's top agents, heroic mice Miss Bianca and Bernard, fly to Australia to save the day. Accompanying the fearless duo are bumbling albatross Wilbur and local field operative Jake the Kangaroo Rat.",6.637,1313,0.6754,en
920206,The Singer Cat,1995-01-01,Hasani who is an orphan is living with his little sister Goldouneh in an orphanage. One day a couple come there to adopt a child. They chose Goldouneh but Hasani who believes that their father is somewhere waiting for them is refusing...,3.0,1,0.0468,fa
192287,La Droite a-t-elle tué Nicolas Sarkozy,2013-05-07,,7.5,1,0.0379,fr
97589,Leprechaun's Revenge,2012-03-17,"An evil leprechaun who has been imprisoned within the roots of a majestic old oak tree, is accidentally set loose on St. Patrick's Day. Once free, he takes out his bloody revenge on the descendants of the people who originally imprisoned him.",5.14,57,0.3443,en
627913,Film No. 9,1980-01-01,"A reflection on noise, silence, and grain. (Filmform)",6.5,1,0.0725,sv
590528,Neza: Vice City,2006-03-24,"Lopaka is a rather simple looking dude, but he controls all the drug pushing, gangs and whores.",4.0,4,0.1019,es
412187,Love in Hong Kong,1983-01-01,"Julie is put under pressure by her boss when his newspaper loses in circulation to a rival. Given the responsibility of devising a series of ""scoops"" to regain the paper's popularity, she invites her two friends, Barbara and Carol to Hong Kong.",2.3,3,0.1534,en
312894,Woman Against Woman,1938-06-24,A newlywed unhappily discovers that her husband's scheming ex-wife still has a controlling influence in his life and home.,6.5,2,0.1882,en
696954,In a Chinese Restaurant,1900-11-25,"Two Chinese men (in full regalia) and an American-style tough are sitting at a table, eating out of bowls, all of them using chop sticks; The American is quite practiced with his chopsticks, eating things of large size and indeterminate composition.",3.0,1,0.0143,en
231489,Boys' Ranch,1946-07-18,"A juvenile delinquent is sent to a rehabilitation ranch, but he immediately proves to be a troublemaker.",6.5,4,0.173,en
806762,IMPACT Wrestling: Hardcore Justice 2021,2021-04-10,live Saturday April 10,6.0,1,0.1497,en
44618,The Man Who Quit Smoking,1972-12-16,"The Plot focuses on Dante Alighieri, a young man who loves smoking. When his father dies Dante inherits $17 million on one special condition: He must give up smoking in 14 days and then stay smoke-free for an entire year. If he fails, his uncle inherits the $17 million instead. Dante has a living hell while trying to quit, and hires a private detective agency called Little Secret Service who he gives free hands to stop him from smoking, While his uncle, who has taken up smoking himself, also does everything he can to make Dante smoke again.",6.4,28,0.2361,sv
200932,Chicano Love Is Forever,1977-03-11,"A hard-hitting drama about the pressures facing a young Chicano couple and their struggles to balance work, college and marriage, pitting the husband's machismo and self-sacrifice against the wife's desire for agency and companionship.",5.0,1,0.0,en
390541,The Brym,2016-03-01,"Inspired by Celtic poetry, Northern folklore, and the paintings of Hieronymus Bosch, the self-described “fucked-up fable” tells a tale of a supernatural oceanic entity. When this mysterious power possesses a man, he torments the inhabitants of a small seaside town before falling in love with a young woman and conceiving a cursed half-spirit child.",5.0,1,0.042,en
646353,Les Vieilles Canailles : Histoire d'un concert mythique,2019-11-08,,8.0,2,0.0495,fr
162836,Being at Home with Claude,1992-05-26,"The relationship between lovers Yves and Claude comes to an abrupt conclusion when, as the couple are making love, Yves slices Claude's throat, killing him. After being taken into custody for his crime, the police inspector demands to know the reason behind Yves' actions. Yves then weaves the tale of his life with Claude, explaining the origins of their relationship and how it reached a point where murder was the only possible conclusion.",5.5,10,0.2713,fr
414894,Bum,1988-12-01,,5.5,4,0.1681,ru
686573,"Ready, Willing & Able",1999-06-11,"Samantha Martin is injured during a mission and is forced to retire from the CIA. She discovers a mole within the CIA is working with terrorists to acquire chemical weapons set to be destroyed by the U.S. Government. Unable to contact the CIA, she forms a rag-tag group of fellow CIA cast-offs to stop the terrorists and uncover the rogue CIA agent.",2.0,2,0.1561,en
874355,Gone in the Night,2022-07-15,"Upon arriving at a remote cabin in the redwoods, Kath and her boyfriend find a mysterious younger couple already there — the rental has apparently been double-booked. They decide to share the cabin with these strangers until the next morning, but her boyfriend disappears with the young woman, which sends Kath in a spiral to find an explanation for their sudden breakup — but the truth is far stranger than she could have imagined.",5.606,141,1.1677,en
632995,The Primevals,2023-07-23,"Deep in the Himalayas, a group of sherpas kills a gigantic humanoid creature. Convinced that it is the legendary Yeti, Dr. Claire Collier organizes an expedition with her former student Matt Connor and hunter Rondo Montana, among others, to search for more specimens. But what awaits them is something that none of them could have imagined. A colorful fusion of real image and stop-motion that is reminiscent of fantastic films from the 1980s.",5.911,28,0.4415,en
454771,I Will Not Make Any More Boring Art,1987-01-01,"This is an interesting little documentary about the Nova Scotia College of Art and Design, which was apparently one of the global hotbeds of experimental/avant garde art- particularly video art- back in the 70's &amp; 80's. MacGillvary interviews a number of the artists that were formative to the program. Many of whom would go on to become teachers at the school.",5.0,3,0.0387,en
332182,Echolyn - Live at the Ritz Roseville 1995,1995-03-04,"Live from the Ritz, Detroit, MI (March 4, 1995)  Setlist:  1. Uncle  2. A Short Essay  3. My Dear Wormwood  4. Here I Am  5. 21  6. The Cheese Stands Alone  7. As The World",6.0,1,0.0,en
