id,title,release_date,overview,vote_average,vote_count,popularity,original_language,adult
880918,One More Flip,2021-10-01,Demarco Beasley lands in jail after a drug deal gone wrong. He turns to his girlfriend as he has no one else to turn to.,4.0,1,0.2385,en,False
350566,Car Trouble,1986-02-28,"In the throes of a midlife crisis, a man buys a new Jaguar, and it immediately becomes his new love. What he doesn't know is that his wife is as attracted to the Jaguar salesman as he is to the car.",4.5,2,0.4853,en,False
157259,"Hello, Fred the Beard",1978-10-16,,6.8,13,0.1803,pl,False
243754,After Life,2008-01-17,"They play tough, masculine games, when the passion of hunting turns into a thirst for profit, paint into blood, fidelity into betrayal, when betting is friendship, and winning is life. One of the three old institute shareholding partners ""orders"" the fourth - the head of the Bank of Daniel.  But even the hired killer did not know about the explosives in the house. And so, after the explosion in the basement, there are three - the killer, the victim and his daughter. When there is almost no air left, and the search engines have already stopped working, Daniel’s mind starts a dangerous game: which of the worlds is fictional, and which one is the real one, the one in which you save your friends, or the one in which friends kill you ... Daniel solves the problem with three unknown ...",10.0,1,0.1926,ru,False
19401,The Case for Christ,2007-09-11,"Based upon the Gold-Medallion award-winning best-seller, The Case for Christ documents Lee Strobel's journey from atheism to faith through his two-year investigation of the Bible and the life of Jesus Christ.",5.4,5,0.2602,en,False
409969,Barrio,2006-01-01,"A failed footballer, a remote father and one man who becomes grandfather ... In a neighborhood of Mexico City, three mature men tell us little stories about their unfulfilled hopes, love and the passage of time.",5.0,3,0.0143,es,False
699282,"The $50,000,000 Cherry",1987-01-01,An heiress must retain her virginity or lose a fortune.,10.0,1,0.0,en,True
429806,Sweet Daddy,1921-12-11,"Perez plays a henpecked husband who is chained at the neck by his wife in the kitchen and when he tries to stand up for himself, she throws him out of the window where he is dangling for dear life.Once she sends him to the store, Tweedy becomes smitten by a stage actress and tries to woo her with great success until his wife shows up on the scene and all hell breaks loose with cartoon gags.",5.0,1,0.104,en,False
379081,"Pink, Plunk, Plink",1966-05-25,"The Pink Panther learns to play the violin, and interrupts a performance of Beethoven's Fifth Symphony with the Pink Panther Theme played on various instruments.",7.2,11,0.2981,en,False
162545,The Snowman,1985-03-22,"Dorn, a young adventurer and survivalist, is trying to sell 50,000 porn magazines in a flophouse in Malta when he is interrupted by the police. On the run, he finds a luggage storage ticket from Frankfurt Central Station. Together with his friend Lazlo, he sets out to retrieve the contents of the locker - 5 kilograms of pure cocaine. Dorn, who is completely out of his mind, does not hesitate for a second to turn the substance into money. In doing so, he completely overlooks the danger he is putting himself in. Two rival gangs are hunting him down and trying to seize the drugs with all their might.",6.0,7,0.1617,de,False
486078,Il vegetale,2018-01-18,"Fabio struggles with a cumbersome father and a capricious and spoiled little sister who consider him a good for nothing, a “vegetable” in fact. The unfortunate recent graduate looks for a job reacts to the contempt of his family and demanding employers, when an unexpected event remixes roles…",5.708,265,0.3713,it,False
440006,The Happy Couple,1975-10-27,"A comedy about life during the 1970's. A father refuses to accept his son marrying a girl from a different religion, thus leading to several comical situations.",8.0,2,0.08,sq,False
461151,Le chemin,2017-09-06,"Camille, a young lady who has joined a Catholic mission in Cambodia and is ready to take her vows, crosses paths along a river and the Angkor ruins with a Cambodian man, Sambath, on a regular basis.",3.8,2,0.1396,fr,False
482659,Snail House,2017-10-22,"Sofia leaves the city to a provincial town. There she meets Nico and the inhabitants of Casa Caracol, an alternative hostel in the middle of the jungle. Nodding party nights and brotherhood, Sofia falls in love with Nico and joins the ""magical"" village life.",3.7,7,0.2134,es,False
757815,All Is One. Except 0,2020-10-04,"In 1981, Wau Holland and other hackers established the Hamburg based Chaos Computer Club (CCC). The idiosyncratic freethinkers were inspired by Californian technology visionaries and committed themselves to hacker ethics. All information must be free. Use public data, protect private data. But not everyone followed the rules. Computer technology was still in its infancy and the emerging Internet became a projection screen for social utopias. What has become of them? The story of the German hackers, told by the protagonists themselves in a montage of found video and audio material.",6.773,11,0.1162,de,False
382663,Pavada,2016-01-15,"Joy a young man who leads a carefree life. Joy acquaintance Babu Joseph, an English professor, and they reminiscence some seemingly forgotten memories.",5.8,17,2.1586,ml,False
39860,Cat Fishin',1947-02-22,"Spike is guarding a private fishing hole - in his sleep. Tom sneaks in to do some fishing - with Jerry as bait. But one particularly vicious fish turns out to be more than Tom or Jerry bargained for, particularly when he wakes up Spike.",7.321,53,0.4735,en,False
237002,Tokyo Woes,1945-11-15,"Created for the US Navy in World War II. The Mr. Hook character was created by Hank Ketcham while at Walter Lantz Studios, where the first- and only color- Mr. Hook cartoon was produced. A wartime propaganda film about Japan and war bonds. The loudspeaker grille is in the shape of a peace sign as it shouts at Mr. Hook.",4.9,10,0.2575,en,False
151842,Ponnapuram Kotta,1974-01-23,"Ponnapuram Kotta is a 1973 Malayalam language film starring Prem Nazir, K. P. Ummer, Vijayasree and Vijayanirmala in the lead roles.",8.0,2,0.4394,ml,False
289232,The Goob,2014-09-25,"We’re in the middle of a heat-wave in Fenland England. Goob Taylor has spent each of his sixteen summers helping Mum run the transport cafe and harvest the surrounding beet fields. When Mum shacks up with swarthy stock-car supremo and ladies’ man gene Womack, Goob becomes an unwelcome side thought. However Goob’s world turns when exotic beet picker Eva arrives. Fuelled by her flirtatious comments, Goob dreams of better things.",6.2,36,0.5081,en,False
360140,Namo OK,2014-11-06,"After a lighting strike robs him of his memory, a mysterious stranger takes shelter in a small-town temple and embrace Buddhist ways.",7.7,3,0.1036,th,False
410695,Hamlet,2008-02-18,This film consists of 63 minutes and 1 second of white screen.,1.0,1,0.0071,en,False
327867,Ceiling,1962-03-15,"The young Marta has made a break in her medical education to fully invest in her career as a model. We follow her for a day in her life, almost completely without hearing her voice. It is seldom that Marta gets the space to speak, instead she is mostly subject to the voice of others.",5.333,9,0.3493,cs,False
251504,Fuckland,2000-09-20,"Fabián, a magician from Buenos Aires, saves his money from weddings, birthdays, and bar mitzvahs, and uses a hidden camera to document a week-long trip to the Falkland Islands where he has a patriotic plan: to impregnate a British woman. If 500 Argies do this annually, the islands will soon be overrun with children belonging to both cultures.",4.429,7,0.383,es,False
43544,Ma che colpa abbiamo noi,2003-01-10,Seven people in a therapy group are forced to find new ways of coping with their problems when their therapist dies in the middle of a session.,6.4,118,0.4551,it,False
798654,Wager of Love,1993-01-01,"Four women meet on a yacht to exchange stories about their sexual exploits of the past year. The onboard waiter is designated to be the judge of the best story; however, it turns out that his qualifications are tainted by a possible bias. But whose story will be declared the winner?",1.0,2,0.0364,en,False
78946,Arasangam,2008-03-09,A high voltage action movie about a man who goes to Canada to find out the reason behind his missing brother- in-law and stumbles upon an international terrorism plot against India's intellectuals.,5.0,1,0.1942,ta,False
192989,Flame of Araby,1951-12-18,"An Arabian-nights princess and a Bedouin chief contend over possession of a stallion, but unite to oppose the Corsair Lords.",6.1,7,0.5777,en,False
626142,Threesome Bondage Escapades,2019-05-29,A bad time for four distressed damsels tormented simultaneously by two masters or mistresses. In each of these four scenes a hot babe suffers bondage spanking and sexual use under the command of her Doms.,6.0,1,0.0,en,True
696247,What the Night Hides,1963-01-01,,9.0,1,0.1407,el,False
399699,Mobile Suit Gundam SEED Destiny TV Movie III: Flames of Destiny,2006-11-24,"Gathering their forces in the Mediterranean Sea, the Earth Alliance and Orb Union fleets launch a second attack on the Minerva, and this time not even the Archangel's intervention can halt the fighting. While Shinn unleashes his anger against the Orb fleet, Kira and Athrun confront each another in battle, and one of these lifelong friends falls in defeat. Back in the PLANT homeland, Chairman Durandal thinks back on his past and considers his plans for the future... plans which will require the removal of disruptive elements like Lacus and the Archangel crew. In the aftermath of the battle, Shinn reaches a fateful ecision. Stella, the enemy pilot he once promised to protect, is now a captive aboard the Minerva. Stella's physical condition is rapidly deteriorating, and Shinn will have to betray everything he believes in order to save her life.",5.5,2,0.628,ja,False
149146,Mourning for Anna,2010-08-13,A mother deals with the violent murder of her daughter.,5.3,6,0.2265,fr,False
761272,Mom Behind the Wheel,2019-05-16,"Fabiana is a mother whose husband is ill, so she has to take care of the household and face the rough world of cab drivers, while her husband has to take care of the housework, where he is not able to get a foot on the ground.",4.0,2,0.1996,es,False
337857,Reaver,2013-12-13,A brother and sister are confronted by a malevolent supernatural entity...,6.0,4,0.218,en,False
20606,Doghouse,2009-06-11,"A group of men, heading to a remote village to help one of their friends get over his divorce, soon discover that all the women have been infected with a virus that makes them man-hating cannibals.",5.8,367,1.3382,en,False
26566,Father and Guns,2009-07-08,"To save the life of fellow cop kidnapped by a biker gang, a father and a son who cannot stand the sight of each other infiltrate an outdoor adventure group-therapy for fathers and sons. Their biggest challenge is to survive the therapy without killing each other.",6.23,37,0.4616,fr,False
247543,New Fist of the North Star: When a Man Carries Sorrow,2004-05-28,"Destruction and betrayal take center stage in the latest installment of the New Fist of the North Star series. When Kenshiro returns to find the city in ruins and its citizens tormented, his pain is compounded when he is betrayed and imprisoned by Tobi. As Tobi prepares a brutal assault on Seiji, Kenshiro must summon all of his strength to break free and take put a halt to his former friend's destructive scheme.",5.6,18,0.8345,ja,False
639887,Forget You,2019-10-15,"The Directorial Debut of Naomi Scott (Charlies Angels, Aladdin) and Husband Jordan Spence brings a quirky creative Music Film with striking visuals. This story explores the way in which 'forgetting' is not an easy task.",1.5,2,0.0907,en,False
660072,"For Love, with Love",2018-11-09,"It is a tale of Sonamoni, a married daughter who is sincerely taking care of her mentally unwell dad Parag Da.",2.0,1,0.0286,bn,False
971503,A Merry Christmas Wish,2022-11-12,"Janie, a rising marketing executive living in The Big Apple, returns to her hometown of Woodland Falls when her Great-Uncle Randall passes away. Randall has even arranged for his farmhand, Dylan to help at the event, which is being held in the farm’s sprawling barn. Aware that her Manhattan boyfriend is anxious for her to return to the city so the pair can jet off to a previously planned holiday on the beach, Janie begins to feel an unexpected emotional tug about living life in a more authentic, meaningful way.",5.9,44,1.0332,en,False
9290,Crocodile Dundee in Los Angeles,2001-04-12,"After settling in the tiny Australian town of Walkabout Creek with his significant other and his young son, Mick ""Crocodile"" Dundee is thrown for a loop when a prestigious Los Angeles newspaper offers his honey a job. The family migrates back to the United States, and Croc and son soon find themselves learning some lessons about American life -- many of them inadvertent",5.2,626,2.0038,en,False
515854,A Moon Made of Iron,2018-04-17,"In mid November, the dead ones appeared floating on the Strait of Magellan tied together to life vests, cellular phones, computers and passports. Two of them were found malnourished, another with scurvy and typhus and Yin Xinji’s body was never found. In June, Carmen’s cousin told her that on the lighthouse close to his ranch, a starving Asian man, hid there for three days before disappearing. Apparently, he headed towards La Pampa.",7.0,1,0.0621,es,False
716694,Retiens Johnny,2020-06-14,"When Johnny Hallyday died in December 2017, thousands of orphaned fans felt the need to come together to revive their idol.  At their request, the Madeleine Church opens its doors and organizes each month a tribute to the intention of the missing singer.",8.0,1,0.1431,fr,False
743931,Say Your Prayers,2021-04-02,Two orphaned brothers turned radical Christian hitmen venture to rural Ilkley under the instruction of Father Enoch. Their mission: assassinate the famed atheist writer Professor John Huxley.,7.3,9,0.5632,en,False
666195,Down Home,1992-12-01,"A down and dirty fuckfest with superhung megastar Kris Lord, all-American Jeff Hammond, and a cast of the most wholesome sexy men you'll ever see!",9.0,1,0.0,en,True
497196,L'été 36,1986-02-06,"In 1936, the life of the inhabitants of a Breton manor is disturbed by the arrival of workers on vacation.",1.0,1,0.1992,fr,False
363520,P.O.V. Punx,2008-06-27,Watching these POV scenes will make you feel like we're in your bedroom. There's no B.S. in this movie - no cheesy stripteases or fake moaning and groaning. It's just me and my slutty punk rock girls being ourselves.,8.5,2,0.0,en,True
47777,Dragon Half,1993-03-26,"Mink - the daughter of a dragon and a retired dragonslaying knight - sets out on a journey to get tickets for a concert held by Dick Saucer, world-famous teen idol and dragon hunter. Meanwhile, the corrupt king of the land is trying to take her hostage to get at her mother, and his magic-using daughter seeks to foil Mink's quest out of sheer spite.",5.882,17,0.9637,ja,False
999486,Sweet Silence,1990-01-01,"An over-the-hill journalist who now works at a tabloid smells a new story: He aims to discover the background behind the mysterious Michelle, a top star of the photo industry. Nobody knows where she comes from, where and how she lives. She never gives any interviews, but simply makes her photos and disappears without a trace. Together with his photographer, the journalist searches for clues which lead him quickly into trouble.",6.0,2,0.0,de,True
684412,Charmed by the Sirens,1911-08-18,"Short fairy tale in which a young prince falls under the spell of a siren while taking a walk along the beach with his fiancé. Right before the marriage he has a vision of the siren. He decides to go back to the coast and disappears into the waves with the siren, leaving behind his bride.",5.0,1,0.0389,fr,False
971539,Love's Playlist,2023-03-05,"When streaming music exec Amanda volunteers to lead a make-or-break company launch party, she’s partnered with Sam, a seemingly arrogant brand rep. Amanda’s unaware that Sam is also the man she’s been flirting with in an anonymous online chatroom. As the two grow closer, and Amanda finds out Sam’s true identity, she must navigate her feelings for the man she once thought she couldn’t stand.",6.2,7,0.3916,en,False
195628,The Chimney Sweep and the Miller,1900-04-21,"A chimney sweep and a miller become involved in a street fight. The sweep has a bag of soot on his back, and the miller a bag of flour.",4.313,8,0.0322,en,False
794947,BLUE EDIT,2020-11-01,"A cinematic reflection focused on the quotidian, with unexpected sound/image juxtapositions and bristling space/time vortices made cognizant through editing.  The film was begun in a ""blue"" moment a year ago, returned to during the Covid19 pandemic and lockdown in New York City. It's pace, melancholy, and concentration on the everyday, rather than the grandiose, seem particularly suited to this moment in history. As well it returns again and again to themes of mortality and goodbye. The result is allusive and idiosyncratic, exhibiting cross-national globalism within and through the adjacencies of form and content.",6.0,1,0.1064,en,False
400157,Wonder Park,2019-03-13,"A young girl named June with a big imagination makes an incredible discovery -- the amusement park of her dreams has come to life. Filled with the world's wildest rides operated by fun-loving animals, the excitement never ends. But when trouble hits, June and her misfit team of furry friends begin an unforgettable journey to save the park.",6.5,715,3.0206,en,False
254721,Stations of the Cross,2014-03-20,"Maria finds herself caught between two worlds. At school this 14-year-old girl has all the typical teenage interests, but when she’s at home with her family she follows the teachings of the Society of St. Paul and their traditionalist interpretation of Catholicism. Everything that Maria thinks and does must be examined before God. And since the Lord is a strict shepherd, she lives in constant fear of committing some misconduct...",7.036,124,0.4375,de,False
722069,Marilyn Chambers Guide To Anal Sex,2007-04-09,"Learn from a superstar as Marilyn Chambers narrates this instructional guide on how to get off with anal foreplay, gentle lubing, and deep probing.  Let Marilyn's loving experience as one of porn's sexiest women show you how to give you and your partner the ultimate in sexual ecstasy - anal sex - like an expert!  Three of porn's hottest and nastiest sluts illustrate Marilyn's insatiable techniques for enjoying the raunchiest kind of sex... giving it to her up the ass!",8.0,1,0.0,en,True
526466,The Case Against X,1952-06-11,"Paul Dorgères, a wealthy industrialist, has been mysteriously murdered. The investigation is entrusted to the experienced Chief Inspector Bonnardel and his young rookie assistant, Inspector Richard. Suspicion turns to his mistress Catherine Villard, with whom he had just broken up on the night of the crime. She is soon arrested and charged. However, Inspector Richard discovers a button at the scene of the crime which could help him to trace the trail and confound the culprit(s).",6.5,3,0.3301,fr,False
120845,Tonight or Never,1931-01-04,"A young opera singer finds her career stalled because of her cold and passionless performances, until she finds romance with a handsome admirer.",5.889,9,0.3799,en,False
227234,Street Team Massacre,2007-10-11,"Two rival juice companies, Eco-Elixir and Jock Juice, accidentally unleash an experimental formula of energy drink on an unsuspecting group of concert- goers. This formula turns whoever is unfortunate enough to drink it into flesh-eating crazies!",1.0,2,0.2493,en,False
324535,Cosplay Fetish Battle Drones,2013-12-11,"It's Morphin' time! There's a tumor in the collective unconscious, and it's up to 6 young people to draw on its power to become the Struggled Reagans! Armed with Metaphysical super powers, a giant robot, and perverse sexual fetishes, they can defeat an ancient Hindu god and his googley eyed monster...Right?",1.25,4,0.1625,en,False
42705,Haunted Boat,2005-04-19,Six teenagers on a boat trip get lost in parallel dimensions where they are forced to face their greatest fears.,3.667,12,0.753,en,False
528618,The Lost City of the Pharaohs,2016-02-19,,8.0,1,0.1268,en,False
241693,Beyond Beauty: Taiwan from Above,2013-11-01,Documenting Taiwan from an aerial perspective offering a glimpse of Taiwan's natural beauty as well as the effect of human activities and urbanization on our environment.,7.6,21,0.2566,zh,False
70421,Idiots=Product+Money,2010-11-17,"The movie follows the adventures of four lovable young idiots as they embark on a journey into the underworld to save their sexy landlord's house from foreclosure. In their quest to raise $50 000 in three days, they find themselves caught in the midst of a holy war where survival is their only hope.",3.8,3,0.0379,en,False
225525,Perry Mason: The Case of the Lost Love,1987-02-23,Perry must defend the husband of an old flame from a murder charge.,7.2,10,0.6976,en,False
262179,Five Days from Home,1978-07-30,A man escapes from a Louisiana prison to be at the California hospital bedside of his ailing son.,6.0,3,0.1527,en,False
467004,Pick the Youth,2011-10-28,"A-Sen is born in an aristocratic family. His family has a long tradition of practicing medicine. Before the high school entrance exam, A-Sen is transferred from a music class to a normal class, which his father believes would lead A-Sen to a better future. Unexpectedly, A-Sen joins a rock band for a music.",10.0,1,0.3077,zh,False
991257,Sparkle: A Unicorn Tale,2023-08-18,"Fifteen-year-old Annabelle runs away from an orphanage with two other kids to rescue the animals on her family's farm before they're taken by a greedy neighbor. The orphans discover a magical unicorn has taken up residence, and they try to determine the mythical beast's purpose.",6.0,3,0.4066,en,False
131435,Sleepy Eyes of Death 4: Sword of Seduction,1964-10-17,"A fugitive christian ""saint"" (female, of course!) and a sadistic drug-addled princess both have their eye on Kyoshiro. The fact that a bunch of ruthless smugglers also want him dead is the least of his problems!",5.5,12,0.6987,ja,False
316308,Connection,1981-12-05,"In Connection, a static shot of the sky with moving clouds is subdivided into regular geometrical regions, which are then individually (and rhythmically) manipulated.",6.4,4,0.0331,xx,False
438911,Living the Quake,2006-04-21,,8.0,1,0.0756,en,False
578694,Easter Snap,2019-01-25,"With a baited handling of American symbolism, filmmaker RaMell Ross joins five men in the deep South, Alabama, who resurrect the homestead ritual of hog processing under the guidance of Johnny Blackmon.",4.0,2,0.2062,en,False
292141,The Right of Youth,1911-01-02,"Court huntsman, Søtoft, is courting his daughter Else’s lady-in-waiting, Miss Engelke. That’s why it’s a bit of a punch in the stomach when, late one evening, he discovers his son Ove in close contact with her. Chamberlain von Plessen, who had been gossiping to Søtoft and is himself spying on the young couple, is going to set fire to the room they’re in. The hurt Søtoft wants to leave the young couple to their cruel fate – that is until he discovers that it’s not Engelke, but his daughter Else, who is trapped in the flames with her brother. (Stumfilm.dk)",6.6,235,0.2432,da,False
717508,Daa El-Omr Ya Walady,1978-02-20,"Fatima gets involved with the crook Abbas who lures her in with wealth before he gets arrested. Fatima meets Dr. Ahmed and he marries her despite her past, and she gives birth to Samir. When Abbas comes out of jail, he looks for Fatima, which turns her life into a nightmare.",6.0,2,0.3221,ar,False
671947,DIABOLIK LOVERS ~re:requiem~,2016-12-21,live action Diabolik Lovers,7.9,24,0.2294,ja,False
731110,Finders of the Lost Yacht,2021-07-14,"Pertsa and Kilu are two neighbour boys with different backgrounds. They live adventurous life of a young imaginary mind in small harbour town. Accidentally they get involved in a bank robbery. Through their own investigation of the case, imagination and real danger gets mixed and leads to great adventure where friendship and courage is on stake.",6.6,5,0.7743,fi,False
81522,What?,1972-12-07,A young American woman traveling through Italy finds herself in a strange Mediterranean villa where nothing seems quite right.,5.481,132,1.1174,it,False
361653,Secrets of Mexico's Drug War,2015-03-11,"Drugs, undercover stings and smuggled AK-47s – were US government enforcement agencies bound up in the business of Mexican gangs?",5.0,3,0.2029,en,False
146899,Istanbul Aku Datang!,2012-11-08,"Dian (Lisa Surihani), a sweet and naïve blogger, travels to Istanbul in hopes of convincing her medical student boyfriend Azad (Tomok) to propose to her. She rents out an apartment, not knowing that it is already leased to quirky and shy artist Harris (Beto Kusyairy). Despite the unwanted roomate, Dian tries to make the most out of her sticky situation and conceal it from Azad. But when Azad eventually finds out and leaves her, Dian has to decide whether she should run and fight for Azad or stay and discover if Harris is the one who is meant for her.",5.3,3,0.3137,ms,False
