id,title,release_date,overview,vote_average,vote_count,popularity,original_language,adult
226025,With Eyes Shut,2010-06-25,"Gabo and Maga are an old couple who have lived together all their life and depend emotionally on each other completely. Delia, their grand-daughter, was brought up by them. The three of them live together harmoniously in a cosy atmosphere. At the age of 27, she already has a promising career in a big company. Everything is turned upside down with Maga’s sudden death just at the moment when Delia is assigned a very responsible task, the management of a major project which may launch her carer or bring it to an inglorious end. And what’s  more to it, in the opening of the testament it turns out that Maga had expressed the wish that her ashes be dispersed in the Caribbean. Delia is facing a serious dilemma, as in her grand-father’s life there is nothing else now but the accomplishment of his companion’s last wish at a time when Delia can not abandon her professional commitment for a trip to the Caribbean.",5.5,4,0.058,es,False
277658,A Fire,1961-04-01,"The National Iranian Oil Company (NIOC), formed upon nationalization of the British Anglo-Iranian Oil Company, employed film systematically, producing many films on oil and petrochemical subjects. It also made films depicting Iran's progress and modernization, highlighting the role of the Shah and NIOC in that direction. Under its auspices, Ebrahim Golestan directed A FIRE (1961), a highly visual treatment of a seventy-day oil well fire in the Khuzestan region of southwestern Iran. This film was edited by the Iranian poet Forough Farrokhzad and won two awards at the Venice Film Festival in 1961.",7.5,6,0.1264,fa,False
442232,Ariel,1983-05-23,"Ariel is a highly energetic and colorful divertissement of abstract film achieved with improvised home color processing and a physical, almost sculptural manipulation of the film surface.",9.0,1,0.1,en,False
364983,City,1958-10-23,"For nine years in the 1950s, Jan Troell worked as a teacher at the Sorgenfri primary school in Malmö (an experience he drew on for his study of a teacher's relationship with his class, Ole dole doff (Who Saw Him Die?) in 1968); he lived in a house once occupied by Ingmar Bergman. In Malmö, Troell made his first film, Stad (The City), about a day in the life of Malmö, showing the life of the people from dawn until dusk.",6.5,2,0.0906,sv,False
386805,Red Captain,2016-03-10,"Three years after the fall of the Berlin Wall; six months before the split of Czechoslovakia. Despite all warnings, a young homicide detective sets on investigating a convoluted case that involves Catholic clerical elite and high-ranked agents of the former secret service.",5.2,23,0.2815,sk,False
134521,Lukas' Child,1993-01-01,"Lukas Armand, a skull-faced movie producer, is auditioning lovely young starlets for his upcoming low-budget horror pic. The girls are delighted to learn they've been chosen to star in the film until Lukas' creepy gofers; Jason and Mad-dog kidnap the actresses, one by one and lock the terrified girls somewhere in the bowels of the film studio.",3.375,8,0.312,en,False
79191,Tommy and the Cool Mule,2009-05-26,Tommy Braxxton's father went away to war and never returned leaving Tommy faced with the daunting journey of becoming a man and the responsibility of supporting his single mom and sister. Along the way Tommy finds an unusual friend - a mule...that talks! Driven by the possibility of winning money to help save his family's farm Tommy ignores the insults hurled at him by the older kids and trains on his new mule friend Jackie A. for the big county stock show. Going against all odds Tommy and Jackie A. triumph over the older kids on horses in a spectacular show of resolve and determination.,3.083,6,0.5304,en,False
855139,Mickey Mouse: Mixed-Up Adventures,2017-05-15,,10.0,1,0.0168,en,False
67952,Kathleen Madigan: Gone Madigan,2010-12-17,"Finally, a comedian who isn't whining, insulting or self-loathing. Kathleen Madigan is just brilliantly funny and is still, after 20 years in the business, actually having fun. In this hilarious stand-up special, shot at the Gramercy Theater in New York City, Kathleen takes on politics, American culture and her family who has given her full permission to sell them down them down the river. Winner of the American Comedy Award for Best Female Comic, Madigan has been seen over 12 times on The Tonight Show, The Late Show with David Letterman, The View, Dr. Phil, ESPN, The Joy Behar Show and has had her own specials on HBO and Comedy Central. Madigan was the only comedian in the history of NBC's Last Comic Standing to go unchallenged by any other comedian. She lives in Los Angeles but spends inordinate amounts of time with her family in the Missouri Ozarks.",6.972,18,0.2451,en,False
807760,Violencia en la ciudad,1995-12-31,,5.0,1,0.1598,es,False
87485,Aswang,1992-05-22,"This Filipino vampire film co-directed by Peque Gallaga and Lore Reyes tells the story of an aswang, the traditional shape-shifting creature of local legend. Here, the vampire makes appearances as a giant snake, a young woman (Alma Moreno), and a withered old hag (Lilia Cuntapay). The aswang has a lengthy cinematic history, having been the subject of the first sound film ever produced in the Philippines (1932's Ang Aswang) and migrating, in somewhat altered form, to films in Hong Kong, India, Japan, and, in 1994, to the United States. Aiza Seguerra co-stars with Janice de Belen, Aljon Jimenez, John Estrada, and Alma Moreno.",5.9,4,0.8827,tl,False
328598,Zen & the Art of Dying,2015-03-15,"Zenith Virago is an activist and educator who for over 20 years has been returning the coastal region of Byron Bay, Australia to a more communal, celebratory, and creative engagement with death and dying.",5.5,4,0.0721,en,False
445086,Good References,1920-08-01,"The plot revolves around a down-on-her-luck woman named Mary whose lack of references makes it impossible for her to gain employment.  When a friend falls ill, Mary impersonates her in order to take a job as secretary to an elderly socialite.  Things immediately start going downhill when she is tasked to introduce a ne'er-do-well nephew to high society—but ends up bailing him out of a string of scandals instead.",5.5,2,0.0982,en,False
667410,The Lost Love,1970-10-20,"Laila and Samia are two best friends ,but things are about to change when Laila moves in with Samia and her husband after the tragic death of Laila's husband.",6.667,3,0.1998,ar,False
27163,The Best Christmas Pageant Ever,1983-12-05,"The Herdmans – Gladys, Claude, Imogene, Leroy, Ollie and Ralph – are undeniably the worst kids in the history of the world. They lie, steal, cheat, bully and overall terrorize their small community. But this Christmas, they’re taking over their local church Pageant – and they just might unwittingly teach a shocked little town the true meaning of Christmas.",5.182,11,2.4802,en,False
142372,Manchester United Season Review 2011-2012,2012-12-01,,5.0,2,0.0691,de,False
190447,Die Heinzelmännchen,1956-09-22,,1.9,4,0.1281,de,False
110806,The Ride,2003-11-02,"When cocky, young surfing champion David Monroe wipes out on a big wave, he slips back in time to 1911 Hawaii. Washing up on Waikiki beach, he discovers the true spirit of surfing when he is befriended by a young Hawaiian beachboy not yet known to the world - the future Olympic and surfing legend Duke Kahanamoku.",5.9,4,0.0892,en,False
820678,My Beautiful Bride,2021-04-20,"A man tries to solve the mystery of his girlfriend's disappearance in this dreamlike, erotic tale of love, betrayal, and obsession inspired by the Brothers Grimm fairy tale ""Hansel and Gretel"".",4.0,4,0.3251,en,False
163123,Memories of Tomorrow,2006-05-13,"After being stricken with Alzheimer's disease in the prime of his life, a successful young businessman slips slowly away from his loving family.",6.0,16,0.8246,ja,False
184681,All About You,2012-04-13,"Pauline, a beguiling woman in her 60s, returns to her hometown, Turin, for the first time since she was ten years old. She has inherited her aunt’s apartment in town. In Turin Pauline contacts Dr. Angela Gualtieri, a psychologist whom she had met abroad some time before; Angela runs a maternity centre, the Melograno, a support centre where both mothers to be and young mothers with post natal depression seek help. At the Melograno they are constantly short of help, that’s why Angela asks Pauline to give her a hand in setting up an in-house archive collecting different material relating to maternity: video interviews to new mothers, mothers diaries, photo portraits of mother and child. Pauline accepts and starts her work plunging deep in an emotional material that touches her strongly: the controversial feelings experienced by women in their relation with the child.",5.8,4,0.1262,it,False
324283,Ktown Cowboys,2015-03-15,"Based on the wildly successful web-series of the same name, Ktown Cowboys is a bro-mantic dramedy that follows a group of ball-busting, hard-partying friends wrestling with their evolution into adulthood. As their individual struggles come to light, the group of friends band together in Koreatown and through late nights at seedy after-hour soju bars, karaoke drinking girls and even a stint in jail, each emerges as a better version of himself.",2.0,1,0.1854,en,False
931047,Tortured Obsession,1993-01-01,"Tortured Obsession charts the descent into madness of one Frank Sanders, a security guard who earns his living by stealing from those he's paid to protect. Frank's victims are young attractive women and he's not content to merely rob them of their possessions. The psycho also steals their security stalking them and observing them in their innermost private moments.",1.0,1,0.1466,en,False
312039,Grenzstation 58,1951-03-16,,4.5,1,0.1429,de,False
365049,Abe Sada: The Last Seven Days,2011-06-18,"In May 1936, the “Abe specific incident.” shook the entire country of Japan. It is said that Abe had a live-in maid (Yuma Asami), the owner of the restaurant’s employer Ishida (Nobuyuki Matsuda) was killed, that the cut is more localized. With respect to neither confirm nor deny the crime, frustrated by the testimony of the specific criminal Urakawa Abe (Shun Sugata). And the relentless questioning of Urakawa, we are told the circumstances leading to death and cut from the bodies of penis. Result of fierce passion between men and women debauched erratic, and saw two people … and the constant questioning after the incident, and the constant “last seven days” to depict that Katsuaki the in the here and now Abe no specific story that you have to watch it!",4.625,4,0.8801,ja,False
584137,Circe the Enchantress,1924-10-06,Mae Murray as a Jazz Age baby who treats men like swine until she falls for the upright doctor living next door.,6.0,1,0.2567,en,False
353654,Scary Tales: Night Elevator,1988-12-31,,8.0,1,0.2362,en,False
433815,Lionel on a Sun Day,1997-11-16,"Lionel tries to get into a building through the stairwell, but are on each floor upheld by strange people.",5.0,1,0.1643,en,False
294611,Loco por ellas,1966-03-29,"Starring Lorena Velazquez, German Valdes, Marcelo Chavez",4.8,6,0.1464,es,False
728920,Farewell Scarlet,1975-11-28,"When Scarlet is mysteriously murdered at a blindfolded sex party, her Aunt Olga contacts private Dexter Sleuth to find the murderer.",7.0,2,0.0,en,True
225904,Drama,2012-11-01,"The film starts in a village in Mandya where two youngsters Venkatesha and Sathish, who have failed their pre-degree courses seven times, create problems. Nandini, an ultra-modern girl comes to the village and attracts Venkatesha, who is prepared to do anything for pleasing the girl. Both Venkatesha and Sathish follow Nandini to Mysore, where she is pursuing studies. A strict principal of the college humiliates Nandini when she crosses the limits. Meanwhile, the principal gets murdered and a police officer suspects Venkatesha and Nandini to be behind this murder. There is a lot of confusion when it is revealed that Nandini is the daughter of a Dubai-based don, who is trying to kill a Mangalore-based don. What happens in the end is revealed in an interesting climax.",6.0,6,0.2817,kn,False
895045,Mafia,2020-11-07,"After discovering that his two money launderers, Cleveland and Carlos, had been stealing portions of the money they'd been given to launder over the years, Don Ramos hunts them down.",10.0,1,0.0831,en,False
249494,Paris by Night 83: Những Khúc Hát Ân Tình,2006-05-26,"Paris By Night 83: Những Khúc Hát Ân Tình is a Paris By Night program that was filmed at the Charles M. Schulz Theatre at Knott's Berry Farm in Buena Park, California on Saturday, May 27, 2006. It is the first program to be released to a 3-disc DVD format on Thursday, September 21, 2006.",4.2,2,0.0714,vi,False
456086,Support the Girls,2018-08-24,"Lisa Conroy is general manager at a highway-side 'sports bar with curves', Double Whammies. She nurtures and protects her employees fiercely - but over the course of one trying day, her optimism is battered from every direction. Double Whammies sells a big, weird American fantasy, but what happens when reality pokes a bunch of holes in it?",6.081,173,0.8916,en,False
282985,Orange Blossoms for your Wedding,1950-07-19,"During the time of the Mexican Revolution, the eldest daughter of a conservative family must respect the decision of her parents, and follow the traditions of using the wedding flowers her mother used.",5.7,3,0.2724,es,False
261202,Return to Aztlán,1990-11-06,"When King Motecuzoma dies in 1468, a drought sets upon the Mexicas' land. The younger Motecuzoma sends a retinue to collect tributes from the peasants and make an offering to Coatlicue at Aztlán, the home of their ancestors. The peasant Ollin finds a discarded tribute and makes his own journey to Aztlán to appease his rulers.",5.7,14,0.0877,es,False
279613,Love Lesson,1975-03-04,"A German governess is hired to give German and piano lessons to the teenager son of a rich traditional family, in the 20s. But soon they get involved, and she teaches him love lessons instead.",4.7,3,0.2416,pt,False
892269,Ravanasura,2023-04-07,"An investigating officer is assigned to investigate few brutal murders, where he zeroes in on Ravindra, a criminal lawyer who has penchant for secretly committing murders as the mastermind behind the crime.",4.9,14,1.3947,te,False
660473,2019 Winterfest Preview Special,2018-12-29,Cozy up by the fire and get a sneak peek at all 5 world premiere original movies coming to Hallmark Channel this January as we celebrate new beginnings during Winterfest.,7.0,3,0.0929,en,False
282677,Last of the Badmen,1957-02-17,Chicago detectives in the 1880s head west to find the killers of their colleague.,5.7,3,0.3172,de,False
42434,Christmas in Miami,2005-12-16,"In Christmastime Miami, heartbroken divorcée Giorgio invites himself to stay at his best friend Mario's — unaware that the latter is having an affair with his ex-wife — and ends up pursued by Mario's barely-of-age daughter; nosy and out-of-touch Ranuccio crashes his son's sex-themed holidays before ending up in a series of mishaps with Giorgio.",5.127,507,0.8627,it,False
146465,Bellman and True,1987-11-12,"Hiller, a computer expert, was bribed by group of bank robbers to obtain details of the security system at a newly-built bank. Having obtained the information, he thought he'd seen the last of the robbers. But now they've traced him and his son to London. They hold the son hostage and force Hiller to decode the information about the alarm and then to take part in the robbery.",6.5,18,0.6425,en,False
521338,I'm My Stepdad's Favorite,2018-04-05,"In this tale of seduction, passions will fly, rules will be broken and anything becomes possible! Jewels Vega, Skylar Snow, Kenzie Reeves and Anastasia Rose are definitely the hottest, naughty little stepdaughters we've met yet! Find out why they're daddy's favorite!",7.0,1,0.0,en,True
264386,The Boss,1958-10-23,The head of a criminal gang has all the power among his men until one decides to testify against him.,5.75,5,0.3521,es,False
238570,Born Naked (MLB),2013-11-06,"Andrea and Paula, homosexuals of 23 and 25 years, will show us, through their personal experience, the reality of young lesbians of their generation in Madrid, London and Berlin. Traveling through these three cities, we will meet different organized groups who will describe their proposals and attitudes towards their sexual orientation. With a riveting and edgy style, Born Naked (MLB) introduces us to individuals who refuse to be labeled by society. A generation who fights for their right to reinvent themselves.",1.8,2,0.0589,es,False
656268,Good Mom's Friend 3,2019-10-28,Sexually oriented film about the sexual intercourse between son and lender for paying down debt,5.1,4,1.4543,ko,False
514523,Salam,2018-04-19,A female Lyft driver navigates the night shift in New York City while waiting to hear life-or-death news from her family in Syria.,6.5,3,0.2596,en,False
977681,My Sexy Little Sister 12,2021-11-02,"Remember when your sister suddenly grew up? Her tits popped out. Her hips got shapely. Soon, she was gargling cock and fucking everything that moved - except you. Its ok. Enjoy the fantasy now as you watch these lucky stepbrothers score that hot sister snatch!",8.0,1,0.0,en,True
545664,Cinderella,2018-12-13,Performance by Ballet Diferido.,10.0,1,0.0168,es,False
800214,"Highlands, le coeur sauvage de l'Écosse",2016-01-01,,9.0,1,0.0214,fr,False
389180,The House of Light,1969-03-21,"This plodding piece of cinematic ambiguity finds a married couple engaged in boring conversation in a window as scenery changes behind them. When they manage to talk about love, some of the tedium is lifted in the wake of their amorous verbiage. This black and white effort from Jean Pierre Lefebvre depends on symbolic impressionism rather than plot.",5.2,4,0.0701,fr,False
434082,"A Husband, a Wife and a Lover",1996-03-16,"When her cheating husband has a debilitating stroke, a woman invites her lover to move in with them.",2.3,3,0.4241,en,False
406764,Bulletproof,2012-08-15,"When Salim - who sells governmental forbidden western music and film tapes in the streets- discovers he has a fatal brain tumor, he decides to join the army and get killed defending his ...",3.5,2,0.0872,fa,False
398478,It Had to Be You,2015-10-21,"When her ad agency is absorbed by a much larger, more powerful firm, Darby's rivalry with new partner Derrick could blossom into something else.",5.9,19,0.5114,en,False
476108,Seal - Videos 1991 - 2004,,,8.0,1,0.0,de,False
135475,Vicki,2012-09-29,"VICKI is a loving, somewhat subtly comedic homage to John Carpenter’s truly underrated Christine, adapted from the novel by Stephen King. It’s also a stand-alone tribute to 80′s horror in general, with very controlled compositions, non-choppy edits, a natural lighting style (like the master, Dean Cundy), and a killer synth soundtrack by Umberto and Time Fighter.",8.0,1,0.1248,en,False
163986,The Kid's Last Fight,1933-04-22,"Diaper Dampsey must defend his diaper-weight championship, but someone has kidnapped his girlfriend to make him lose!",5.5,2,0.1277,en,False
477651,The Last Trial,2018-02-21,"Raistlin Majere is a dark sorcerer, weak in body but proud in spirit, who's forced to make a choice between happiness and unlimited power. Only the arrogant high-priestess Crysania and the sorcerer’s brother Caramon can stop his plans. But is it possible that there's more than just darkness hiding under Raistlin's robes?  “The Last Trial” is a fantasy musical that quickly became a cult classic despite it's fairly short run-time. The musical is based on the “Dragonlance Legends” trilogy, written by Margaret Weis and Tracy Hickman.",10.0,1,0.2769,ru,False
254399,Morning Does Not Begin Here...,2014-03-02,"Denisse is 23 years old. She lives in Mexico City. She wants to become a DJ. Laura Esquivel is 19. She was born and raised at a small ranch in Zacatecas known as El Verde. She is goatherd. With Denisse playing music and Laura tending to the goats, it seems improbable that their paths will ever cross, but meeting each other is quite feasible in the world of their thoughts.",5.0,2,0.0663,es,False
188087,Believe It or Not #5,1930-09-11,"At a charity bazaar, Ripley settles a thousand dollar bet by producing man who has not slept in 75 years.",5.0,1,0.0214,en,False
97553,Corpse Eaters,1974-08-16,Zombies eat freshly killed humans.,4.0,8,0.1414,en,False
597420,Die Geisterbehörde,1979-09-11,,10.0,1,0.0556,de,False
688955,Oasis: Second Night Live at Knebworth Park,1996-08-11,"Concert footage of British rock band Oasis performing the second of two record breaking gigs at Knebworth Park in Hertfordshire, England as part of the UK summer leg of their 1996 world tour.  Oasis live at Knebworth park 1996 the two gigs broke box office records when one in every 20 people in the UK applied for tickets. They have since gone into the history books as era-defining concerts. The gigs came during Oasis' world tour for '(What's The Story) Morning Glory?'",9.0,1,0.2598,en,False
292738,Our Fighting Navy,1937-09-25,"Trouble is brewing in the banana republic of Bianco for both His Excellency, El Presidente, and the British Consul, Brant. Rebels, led by Diego De Costa, the trusted ""Minister of the Marines and the Customs"" and Lieutenant Enricquo, the gunnery officer of the small republic's one battleship, have taken over the battleship, and the town. Most of the British citizens have taken refuge at the Consulate or have been evacuated to the small cruiser in Bianco's port, the ""H. M. S. Audacious."" But there are two major issues; the Consul's daughter, Pamela, and Canadian Lieutenant Bill Armstrong have been kidnapped by the rebels and now held hostage on the battleship ""El Mirante,"" and El Presidente was visiting the consulate when the war broke out and is now under the protective custody of the British Empire.",3.0,2,0.2368,en,False
166636,St. Jorgen's Day,1930-08-25,"The priests, stock market officials, and police conspire to squeeze income out of pilgrims come to see relics of a Christ like figure. A pair of con men try to pass of a resurrected saint.",5.3,10,0.0985,ru,False
418387,Big And Natural Tits 15 - Huge and Natural,2009-01-29,"Love big tits, but hate fake ones? Well then you'll love this. Each girl we've got for you, has luscious all natural tatas that bounce, jiggle and feel the way boobs should.",8.5,2,0.0,en,True
414285,"Arbuckle & Keaton, Volume One",2001-09-05,"A collection of five silent comedy shorts co-starring Roscoe ""Fatty"" Arbuckle and Buster Keaton, and produced by their own Comique Film Company: THE BELL BOY (1918), THE BUTCHER BOY (1917), OUT WEST (1918), MOONSHINE (1918), and THE HAYSEED (1919). Volume One of a two-volume DVD series from Kino Video. Musical score by the Alloy Orchestra.",5.0,1,0.1531,en,False
430609,X-Story,2016-11-12,"A guy equipped with the latest model of bionic power arm gets a map and a mysterious ball from a clandestine dealer, and begins the search for a treasure that is hidden inside an abandoned tower in the desert.",6.0,7,0.0239,xx,False
347580,Giddh: The Vulture,1984-01-01,"In a remote village at Karnataka-Maharashtra border in India, the poor residents follow Devdasi tradition according to which young girls are given up in the service of Goddess Yellamma.",4.5,1,0.2636,hi,False
178817,A Love Affair: The Eleanor and Lou Gehrig Story,1978-01-15,"One of the most moving stories in the annals of sports is presented in this true drama documenting the love affair of baseball immortal Lou Gehrig and his wife Eleanor. Their romance spans the time period from his days of glory with Babe Ruth and the New York Yankees to his unsuccessful battle with an incurable disease. As the story begins, the talented but shy Gehrig is already a popular Yankee slugger when he meets the outgoing Eleanor. Their romance begins hesitantly, but blossoms as they exchange letters while Gehrig is on the road with the team. However, Gehrig's possessive mother becomes a formidable obstacle, first to their marriage and later to their happiness. But their love for one another proves triumphant. In the midst of their happiness, when Gehrig is at the peak of his career, he learns that he is suffering from amyotrophic lateral sclerosis. The courage and dignity exhibited by the Gehrigs during this crisis make this a powerful, memorable film.",9.0,1,0.5713,en,False
36458,Madness of the Heart,1949-12-20,"A blind Englishwoman weds a French nobleman and moves into his family's chateau, but she quickly realizes someone there wants her out of the way.",5.9,8,0.6731,en,False
301105,Eric Clapton: The 1970s Review,2014-01-01,"This film, from the makers of Eric Clapton - The 1960s Review, follows Clapton's bold musical journey through the seventies. Featuring new and archive interviews, rare performance footage, contributions from the likes of Bonnie Bramlett, Bobby Whitlock, The Albert Brothers , George Terry, Willie Perkins, Bill Halverson, Clapton biographer Marc Roberty and others, plus a host of other features.",7.0,1,0.136,en,False
