id,title,release_date,overview,vote_average,vote_count,popularity,original_language,adult
993483,7 Days 6 Nights,2022-06-24,"Anand is a wannabe filmmaker who is tired of waiting for his first break. He faces a major setback in his personal life when his girlfriend Vinni moves to the US all of a sudden. Ahead of his friend Mangalam's wedding, he and the friend travel to Goa to spend a good time. There, Anand develops a bond with Rathika, a young girl working at a restaurant. Meanwhile, Mangalam gets into a relationship with a location manager named Ameya.",6.0,1,0.0954,te,False
245153,Fun and Games for Everyone,1969-12-22,"“FUN AND GAMES (FOR EVERYONE): a pitch black and milky white film shot during one of Olivier Mosset's exhibition openings. A psychedelic game of improvisation joins the Zanzibar group with Salvador Dalí, Barbet Schroeder and Jean Mascolo... the solarized image reminiscent of thick strokes of a paintbrush.” - Philippe Azoury",6.6,5,0.1368,fr,False
6083,The Making of Agatha Christie's 'Evil Under the Sun',1982-01-01,"Director Guy Hamilton and several of the stars of Agatha Christie's ""Evil Under The Sun"" walk you through the making of the film.",8.5,2,0.4066,en,False
183615,The Delhi Durbar,1903-01-24,,4.5,2,0.0379,en,False
285749,Rob Zombie: The Zombie Horror Picture Show,2014-05-16,"Rob Zombie's first concert film, The Zombie Horror Picture Show is a feature-length concert film, recorded live over two sizzling nights in Texas. It captures Zombie's elaborate, multi-media production of mind-blowing SFX, animatronic robots, pyrotechnics, oversized LED screens and state-of-the-art light show combined with his powerhouse band featuring John 5, Piggy D and Ginger Fish. The Zombie Horror Picture Show puts the viewer at the center of the hot and nasty action for a blistering set of 16 Rob Zombie classics, including 'Dragula', 'Dead City Radio and the New Gods of Super Town', 'Living Dead Girl', 'More Human Than Human' and the crushing cover of Grand Funk Railroad's 'We're An American Band' from the seven-time Grammy® nominee's Top 10 2013 album, Venomous Rat Regeneration Vendor.",8.2,24,0.2883,en,False
242555,Holidaze,2014-10-22,"Melody, high powered corporate workaholic for a retail conglomerate, is happy to spend the holidays jet-setting with her girlfriends. However, she's in for an unpleasant surprise when her boss sends her to her sleepy hometown to convince the reluctant townspeople to allow them to build a new discount store. Now, forced to reconnect with her family and her childhood sweetheart Carter, her task is not so simple, as all are vehemently opposed to everything Melody's company stands for. Desperate to get out of town and back to her real life, Melody takes a spill and wakes up in an alternate universe where she never left home and is married to Carter! Once determined to leave her small town life behind, Melody must make sense of her new life and decide if you truly can go home again.  - Written by ABC",5.3,43,0.6244,en,False
12652,Nelly and Monsieur Arnaud,1995-08-23,"Nelly leaves her lazy, unemployed husband to work for retired judge Mr Arnaud, forty years her senior, after he offers to clear her bills for her. While she types his memoirs the two develop a close friendship, but Arnaud becomes jealous when Nelly begins dating his good-looking young publisher.",6.9,132,0.9235,fr,False
4822,Kismet,1955-10-08,"A silver-tongued poet and self-proclaimed ""King of the Beggars"" searches old Baghdad for a rich bachelor to marry his dreamy daughter, Marsinah. Along the way, he poses as the renowned sorcerer Hajj and gets in and out of scrapes with an elderly thief, a dim-witted wazir, and his wife. Meanwhile, his daughter develops feelings for a handsome caliph.",5.0,13,0.8598,en,False
951165,Formula 1: The Official Review Of The 2021 FIA Formula One World Championship,2022-02-28,"Watch two of the greatest F1 drivers go head-to-head in the most intense battle for the Drivers’ World Championship in recent memory. The fight between seven-time champion Lewis Hamilton and the young challenger Max Verstappen features dramatic collisions, high emotion, and race after race of incredible driving.  From Esteban Ocon’s surprise victory in Hungary to Daniel Ricciardo’s charge for the flag in Monza to Lando Norris’s rain-soaked gamble in Russia – the 2021 season provided memorable moments at every corner.",7.0,1,0.444,en,False
59161,The Telephone Always Rings Twice,1985-01-23,"Marc Elbichon, a novice private sleuth, is investigating a wave of assassinations bearing a particular characteristic: the perpetrator, dubbed the ""telephone killer"" always strangles his female victims with a telephone cord.",5.5,44,0.6529,fr,False
860760,Kurupting the Industry: The People Just Do Nothing Story,2021-08-11,People Just Do Nothing went from online comedy hit to Bafta-winning sitcom and a big-screen feature film. This is the story of how.,10.0,1,0.2553,en,False
362715,The Secret Tapes of the O.J. Case: The Untold Story,2015-09-30,"The LMN special, “The Secret Tapes of the O.J. Case: The Untold Story,” reveals new insights into both the events surrounding the verdict of the criminal trial, and the various disturbing facets of O.J.’s personality, through statements by O.J. himself. The documentary exposes disturbing realities about O.J.’s thoughts, feelings and behavior before, during and after the trial. And an audio recording that O.J. secretly taped, prior to the infamous Bronco Chase, is heard. The special features rare interviews with key players on both sides of the case, including extensive, candid discussions with Robert Kardashian and Kris Kardashian Jenner.",5.9,5,0.3971,en,False
684295,The Last Dance,,"In the not-too-distant future, a lonely old man works on a mysterious project, hoping to relive the not-too-distant past.",8.0,2,0.1818,en,False
60129,Bratz: Fashion Pixiez,2007-02-27,"When a new girl transfers into school and their classmate Cymbeline starts acting strange,  Cloe, Jade, Sasha, and Yasmin discover the secret magical world of pixies.",7.641,32,0.6626,en,False
933093,The Masked Guy,2021-10-29,,10.0,1,0.0071,it,False
50506,Mrs. Miracle,2009-12-05,"Overwhelmed widower Seth Webster is searching for a housekeeper to help him with his unruly six year old twin sons. ""Mrs. Miracle"" mysteriously appears and quickly becomes an irreplaceable nanny, chef, friend... and matchmaker.",5.995,110,0.6255,en,False
214984,Day of Redemption,2004-12-12,"Small-town retired sheriff Frank Everly finds his life on the skids after his wife Mary is murdered by the ruthless maniac Vincent Pope. When Pope escapes from prison, Everly comes out of retirement to hunt down Mary's killer. The search for Pope soon turns into a twisted game of cat and mouse. Pumping with heart-racing action, this modern-day western will take the audience on a thrill-ride they won't soon forget. Written by David Lee Rawlings",2.0,1,0.3352,en,False
296413,Berlin2Shanghai,2013-01-01,,4.8,2,0.0143,de,False
409668,Smástirni,2014-01-01,DORA (14) is a troubled teenager who is disconnected from her parents who want nothing more than for her to talk to them. When she starts displaying dangerous behavior her parents start to wonder is she just a troubled teen or is there something she is hiding.,5.0,3,0.0,en,False
762008,"The Snowden, Raggedy Ann & Andy Holiday Show",1998-11-27,"Daring leaps, amazing acrobatics, marvelous music, sensational skating and a magic mirror make this special holiday show a skating spectacular on ice. In this exciting tale of dreams fulfilled, beautiful magic mirror reveals the wishes of small children to Snowden, Raggedy Ann & Andy, Doc and an all-star cast of skaters.",9.0,2,0.1112,en,False
255603,The Spider's Web,1938-10-21,"Pulp hero ""The Spider"" seeks to destroy all criminals.  In this serialized adventure, he battles The Octopus, who intends to replace the government of the United States.",6.0,1,0.2793,en,False
95608,The Only Living Boy in New York,2017-07-27,"When a young man learns that his overbearing father is having an affair, he tries to stop it, only to be seduced by the older woman as well.",6.4,339,1.4474,en,False
340017,The Alcohol Years,2000-11-09,"Carol Morley returns to Manchester, where in the early 1980s, five years of her life were lost in an alcoholic blur. The Alcohol Years is a poetic retrieval of that time, in which rediscovered friends and acquaintances recount tales of her drunken and promiscuous behavior. In Morley’s search for her lost self, conflicting memories and viewpoints weave in and out, revealing a portrait of the city, its pop culture, and the people who lived it.",6.3,3,0.1927,en,False
178582,Taking Wing,2000-07-05,"This is the story of Stan, a young man who might be considered an ordinary, run of the mill guy. But his love and passion for the theatre propels him to realize the most extraordinary desires. He is very attached to his grandfather, who owns a butcher's shop and who offers that Stan take over the family business. But Stan refuses. He decides to drop out of school and move out of his family's apartment, despite the opposition of his parents. His uncle is the only one to support him in the impossible dream of becoming an actor.",4.0,1,0.2657,en,False
424617,Annie Lloyd,2008-09-01,Annie Lloyd is a daughter's complex and poetic documentation of the last four years of her mother's life and a portrayal of the creativity and wisdom of old age.,8.5,2,0.0456,en,False
645981,Summer Knight,2019-11-03,"Summer, 1997. In a small community in southwest China, an 8-year-old tries to capture the thief responsible for stealing his grandma's bike and enters the moral quandary for the first time.",6.0,4,0.6247,zh,False
126955,Bad Blood... the Hunger,2012-10-26,"Several college students embark on a summer of sun and fun, but find that their adventure turns eerily macabre when dark and ancient forces propel them into a sinister enclave peopled by human, night-stalking, ravenous flesh-eaters whose wit and seemingly benign exteriors hide dreadful and deadly secrets that border on the supernatural.",8.3,3,0.4079,en,False
55627,100 Days,1991-05-31,"Devi is gifted with Extra Sensory Perception (ESP). Her gift comes to light one day while playing tennis with her friend, Sudha, when she has a vision of her sister, Rama, being shot to death by a man in a black raincoat. She telephones Rama, finds she is safe and is relieved. Shortly thereafter Rama disappears, the police are notified, but are unable to find any trace of her. Devi then meets multi-millionaire, Ram Kumar, both fall in love and get married. She moves into his once abandoned and legally disputed bungalow, and that's when she starts having visions again. These visions lead her to a wall that is loosely plastered",5.3,9,0.5791,hi,False
634903,A Very Christmas Story,2000-11-03,"Crazy adventures of an accountant with a briefcase full of defrauded money, a girl desperately looking for money for her orphanage and an Angel of Death, who doesn't know anything about money and doesn't need too. Death begs God for just one day of vacation. Since there is much to do on the earth, a substitute - the Angel of Death - is found for the job. Right from the start he runs into bad luck and what is more a beautiful blonde - the Guardian Angel - is bothering him. Little Angelica moves out in search of Santa Claus. Christmas Day is coming soon, so she wants to fulfill her Christmas wish - to find money to save her orphanage from closing down. On the way the little girl meets an accountant named Claus who has stolen a huge amount of money. He is being chased by a bunch of bumbling hoodlums.",2.0,1,0.1908,en,False
189344,The Wrong Mr. Fox,1917-04-28,An unemployed actor is mistaken for the new preacher in a small town.,5.0,2,0.0527,en,False
18215,Boxing Helena,1993-03-22,"A top surgeon is besotted with a beautiful woman who once rebuffed him. Unable to come to terms with life without her, he tries to convince her that they need each other. She has other ideas, but a horrific accident leaves her at his mercy.",5.1,232,1.0771,en,False
213610,Secrets of Body Language,2008-10-01,"Humans can communicate volumes without ever opening their mouths, all through the amazing power of body language. This surprising History Channel presentation explores the subtle art of silent (and sometimes, inadvertent) signals, and examines the ways in which political leaders and celebrities use the method to entice audiences to trust and follow them.",7.0,2,0.0661,en,False
354042,The Mysterious Man,1910-03-31,,4.0,1,0.0429,fr,False
8740,The Vanishing,1988-10-27,"Rex and Saskia, a young couple in love, are on vacation. They stop at a busy service station and Saskia is abducted. After three years and no sign of Saskia, Rex begins receiving letters from the abductor.",7.461,694,2.3164,nl,False
23751,Complicity,2000-05-06,"Local journalist, Cameron Colley writes articles that are idealistic, from the viewpoint of the underdog. A twisted serial killer seems to have some motives. His brutal murders are also committed on behalf of the underdog. The stories begin to merge and Cameron find himself inextricably and inextricably implicated by the brutal killer. The arms dealer that Cameron plans to expose is found literally 'disarmed' before he can put pen to paper. The brewery chief, loathed by Cameron, who sold up at the expense of his workers, finds himself permanently unemployable. The police are convened of Cameron's guilt and so are half his friends and colleagues. Cameron is forced to employ all his investigative skills to find the real killer and his motive.",5.9,13,0.5736,en,False
620984,O Coringa do Cinema,2019-02-12,,10.0,1,0.0535,pt,False
611646,Wakazuma nikki: Zecchôdo,1986-03-01,,2.0,1,0.2576,ja,False
276038,Miracle at Moreaux,1986-01-01,"Drama - On a December night in 1943, three Jewish children escape from Nazi-occupied France and are given refuge by Sister Gabrielle at a Catholic school in which the gentile students must face their fears about harboring Jews from the Nazis. As the students become acquainted with their Jewish peers, they grow more sympathetic to their situation and eventually go to great lengths -- and take serious risks -- to save the lives of their newfound friends. -  Loretta Swit, Geneviève Appleton, Milan Cheylov",6.0,3,0.2928,en,False
520311,Van Morrison  Live In London,2008-02-10,"Van Morrison showcases tracks from albums including Keep It Simple, Magic Time and Vanlose Stairway, backed by a full band and joined by guests including guitarist Mick Green and organ maestro Georgie Fame.",5.0,1,0.1487,it,False
382997,Onda su onda,2016-02-18,"Two under-appreciated artists meet while traveling to Montevideo, where one will give a concert. They initially dislike each other but eventually build a relationship as a means of finding a way out of their existential loneliness.",4.7,32,0.1924,it,False
283587,Beasts of No Nation,2015-09-11,"Based on the experiences of Agu, a child fighting in the civil war of an unnamed, fictional West African country. Follows Agu's journey as he's forced to join a group of soldiers. While he fears his commander and many of the men around him, his fledgling childhood has been brutally shattered by the war raging through his country, and he is at first torn between conflicting revulsion and fascination.",7.591,1770,3.5045,en,False
744369,Riders,2024-04-16,"In Argentina, the majority of delivery drivers working for local UberEats clone apps are Venezuelans who have fled the crisis ravaging their country. Filmed during the pandemic in Buenos Aires, Caracas and Colonia Tovar, Riders forcefully immerses us in the gruelling daily lives of those exploited by the platform economy at both ends of South America.",7.0,1,0.1568,es,False
79762,Slices of Life,1985-02-06,"A series of humorous sketches on life: ""A Night to Remember"", ""Summit Showdown"", and ""A Book? That's personal!""",5.4,19,0.9566,fr,False
434280,American Guinea Pig: Sacrifice,2017-03-01,A young man suffering from significant childhood trauma believes there are portals to the darkness around him that can be accessed through extreme self-mutilation. He locks himself in his home and proceeds to perform acts to summon the Goddess Ishtar to help him cross over to the other side.,3.143,7,0.3587,en,False
621727,The Lost Okoroshi,2019-10-03,"Haunted by dreams of an ancestral Okoroshi masquerade, a disillusioned security guard wakes up one morning to find himself transformed into a mute, purple spirit, in Abba Makama’s surrealist romp through the sprawling city of Lagos.",6.4,10,0.2372,en,False
689196,Johan: Secrets du Tournage,2006-10-01,"Thanks to his collection of personal material, Philippe Vallois tells us the story of Johan, a film inspired by his beloved; what, in 1975, was considered the first French gay auteur film.",1.0,1,0.0214,fr,False
301873,"Stand Up Straight, Delfina",1977-01-01,"A Macedonian girl is trying to swim the British Channel. During the ordeal, she remembers her troubled past.",5.5,4,0.2575,mk,False
649719,The Renovation,2020-02-19,"A couple inherit a 'house of their dreams' and for a while they think they got lucky, but soon find themselves in the middle of a renovation nightmare.",5.3,12,0.4664,fi,False
531597,Satyameva Jayate,2018-08-15,"DCP Shivansh has been tasked to catch Vir, the man behind police killings in the city. Both are eventually against the same enemy but divided by a fine line, the law.",6.519,54,1.1196,hi,False
418008,Sweet Maddie Stone,2016-09-25,"15-year-old Maddie Stone rules her school yard under the protection of her family name. But after discovering her notorious father has been arrested, she has to make his bail money or lose the yard. The more Maddie fights, the more her world spirals out of control - and the closer she gets to becoming the man she’s trying to save.",10.0,1,0.2834,en,False
154804,Almost Elvis,2001-08-04,"Almost Elvis is a searing documentary that chronicles and attempts to explain the cult of personality that is the Elvis impersonator. Filmmakers tail a handful of Elvis impersonators from around the country who are all vying to win the 1999 Elvis World Championship in -- where else? -- Memphis, Tennessee.",5.3,3,0.0143,en,False
120724,Sunset Across the Bay,1975-02-20,"A married couple, after a life time of work and bringing up a family, retire and awaken to the fast changing world around them, the habitual nature of their relationship, and what they have left.",6.0,1,0.2833,en,False
287536,Satellites,2013-06-06,"SATELLITES is a documentary about the passion for soccer told through the points-of-view of characters who were following somehow the final match of the Brazilian Soccer Cup. The film moves the focus from the game to the field's margins, to the fans, to outside the stadium. The movie intends to capture the tension, atmosphere and charm of a final match. SATELLITES translates, based on images captured during that game, the sensation of being at the stadium watching the game with no images of the game itself.",5.0,3,0.0382,pt,False
400534,Menandros & Thaïs,2016-04-28,"A kidnapped bride. A distraught hero. Odysseys through surreal worlds. Menandros and Thaïs are freshly married, but the wedding day ends bloodily. Thaïs is abducted by pirates. Searching for her, the bridegroom becomes a bloodthirsty monster, his horse grows wings, a witch promises him to another woman, King Xerxes unmans him, but everything comes to an happy end. Or does it?",6.0,4,0.1801,cs,False
324709,Kristin Chenoweth: Coming Home,2014-11-28,"Kristin Chenoweth is recognized across the full spectrum of entertainment as an Emmy and Tony Award-winning actress of stage (""You're A Good Man, Charlie Brown,"" ""Wicked,"" & the upcoming ""On the Twentieth Century""), television (""Pushing Daisies,"" ""Glee,"" ""West Wing"") film (Disney's ""Descendants,"" ""The Boy Next Door"") in addition to her career as an accomplished singer. With this recording, she returns to her Broken Arrow, OK, home to perform songs in the Performing Arts Center housing the aptly-named Kristin Chenoweth Theater. The repertoire includes songs from Kristin's iconic Broadway performances, her albums, and other popular productions.",5.0,1,0.1775,en,False
436976,Doctor Who: The Evil of the Daleks,1967-07-01,"The Daleks draft the Second Doctor into distilling the Human Factor. Once implanted, it will make the Dalek race invincible. Jamie's faith in the Doctor is stretched to the limit as the Doctor appears to be collaborating with the Daleks. The Doctor has a few tricks up his sleeve, but then again so might the Daleks.",8.4,5,0.2449,en,False
376236,Nuts!,2016-01-22,"The true story of John Romulus Brinkley, a small-town Kansas doctor who discovers in 1917 that he can cure impotence by transplanting goat testicles into men. And that’s just the tipping point in this stranger-than-fiction tale. With the balls of a P.T. Barnum, the gonads of goats, and the wishful dreams of flaccid men, Brinkley amassed a fortune, was almost elected Governor of Kansas, invented junk mail and the infomercial, and built the world’s most powerful radio station. By the time all of the twists and turns of Brinkley’s story are revealed, Nuts! certainly earns its title.",6.741,29,0.3428,en,False
567066,Moonfire,2018-10-06,"A brother and a sister are trapped in a chaotic and emotional moment in their life. Through a series of violent acts, they do whatever they can to forget what really hurts inside.",5.0,1,0.2155,da,False
509147,Angels,2012-05-03,"When Michael, a successful theatre director learns that he suffers from an incurable disease, he resigns and goes to an abandoned cottage to write his memoirs. His life companion and a nurse stay by his side. They have a hard time trying to make the last days bearable of a man who seems to give up his life too easily. Until a charismatic young man shows up.",1.0,1,0.068,sk,False
10322,Being There,1979-12-19,"A simple-minded gardener named Chance has spent all his life in the Washington D.C. house of an old man. When the man dies, Chance is put out on the street with no knowledge of the world except what he has learned from television.",7.621,1024,1.526,en,False
17962,After Life,1999-04-17,"On a cold Monday morning, a group of counselors clock in at an old-fashioned social services office. Their task is to interview the recently deceased, record their personal details, then, over the course of the week, assist them in choosing a single memory to keep for eternity.",7.2,245,2.439,ja,False
759001,Calladita,2020-06-16,"In a summer mansion in the Costa Brava, a young domestic worker has to serve two rich kids while they enjoy their summer. Amongst cocktails, drugs and dishwashers, she will look for her own way of having fun.",5.3,6,0.8722,es,False
129128,Iron Maiden: Beast Over Hammersmith,2002-11-04,"Beast Over Hammersmith is a live album by the British heavy metal band Iron Maiden, released on 4 November 2002. Recorded 20 years previously, during The Beast On The Road tour at the Hammersmith Odeon, the footage was specially co-produced and mixed by Steve Harris and Doug Hall to be a part of the Eddie's Archive box set. Even though this album contains material from The Number Of The Beast, it was actually recorded two days prior to its release (although Run To The Hills had already been released as a single). An abridged video version of the concert is included on Disc 1 of The Early Days DVD. Intended to be released on VHS around the time of its recording, the band withheld the footage as they were unhappy with its visual quality due to lighting difficulties during the show.",10.0,1,0.2129,en,False
123789,Forbidden Women,1948-01-01,"After studying in America, South Seas Prince Sigore returns home with plans to change things on his island. He's opposed by the sultan's sister-in-law, who has plans to control the paradise, and is infatuated with the Forbidden Women and their sensuous ways.",4.0,1,0.1331,en,False
885837,The Dinner After,2021-11-12,"A guilt-stricken Angela visits her parents for what at first seems to be a routine family dinner, only for a painful truth to bubble to the surface, descending the evening into a nightmare.",6.7,5,0.1234,en,False
833860,100 papiers,1999-01-29,,7.0,1,0.0261,fr,False
252596,German Angst,2015-01-24,"Horror anthology consisting of three episodes directed by Jörg Buttgereit, Andreas Marschall and Michal Kosakowski.",5.398,83,0.4851,de,False
538,Janine F.,2004-02-11,The humorous portrait of a female artist. The film follows the career of 24-year-old Janine F. who in 2002 caused a commotion from the rooftop of a Berlin building.,5.0,1,0.1417,de,False
58458,Lorna Doone,2001-03-11,"The year is 1675. England is threatened by religious and political rivalries. King Charles II's Catholic brother, James, is next in line for the throne, but many Protestants put their faith in Charles' illegitimate son, The Duke of Monmouth. On the king's death, conflict is inevitable... Over seven days journey from London, Exmoor is a primitive and lawless area. Here, farmer Jack Ridd lives with his wife Sarah, son John, and two daughters. The only shadow over their simple life is cast by the notorious outlaw family the Doones. The aristocratic Doones were banished from their ancestral lands and now live through looting, theft, and murder. Their brutality is legendary...",5.69,21,0.752,en,False
281831,May Madham,1994-09-09,"Sandhya is fed up of her life that is controlled by her father. She runs away from home but soon loses her money to Eeshwar. Waiting around for him to pay her back, she falls in love with him.",8.0,1,0.4448,ta,False
