id,title,release_date,overview,vote_average,vote_count,popularity,original_language
500869,Viper Club,2018-10-26,"ER nurse Helen Sterling struggles to free her grown son, a journalist captured by terrorists in the Middle East. After hitting walls with the FBI and State agencies, she discovers a clandestine community of journalists, advocates, and philanthropists who might be able to help.",5.825,20,0.2758,en
612553,Vivir para amar,1980-03-20,Bar-band yout gets groomed for stardom: exploitative management and loss of personal authenticity are the result. Can he pull out of his Siempre En Domingo death-spiral?,6.0,5,0.0738,es
239067,Life with the Kids,1990-02-01,"The story of one man dealing with an unexpected series of events, discovering his youth once again in the relationship with a much younger woman and finally coming to grips with his age, and the fact that he hasn't been there for his family like he should have.",4.4,9,0.5381,it
89823,The Big Animal,2000-08-25,"Left behind by a circus, a camel wanders to the house of a simple middle-aged couple in a Polish village. Although the wife is initially bewildered by the strange and unexpected animal, her husband immediately adopts it as a pet.",7.1,23,0.2853,pl
374925,Requiem for a Gunfighter,1965-06-30,A gunfighter takes the identity of a murdered judge in order to avenge his death.,6.0,1,0.1232,en
413019,Muthuramalingam,2017-02-24,A rural family known for their bravery and generosity are faced with a unexpected situation that poses a threat to their good reputation.,2.0,2,0.1694,ta
74514,Latin Lovers,1965-08-11,The film is composed of five episodes which depict Italians' love lives in the 1960s.,5.9,7,0.1515,it
709862,Joseph's Children,2015-03-04,"From the place where Joseph Brodsky died to the place where he was born, the distance is now insurmountable: there is no country or city where the poet left forty years ago in the world anymore. And that means there's no way to go back. But in the summer of 2014, by order of Brodsky's widow Maria, the last things in the poet's life are sent to the first house in his life. To St. Petersburg, to the corner of Pestel and Liteyny, to the Muruzi house. This film is an attempt at a group portrait of those whom Brodsky would have found if he had had the opportunity to return to Russia today. Formally, the characters of the film are talking about Brodsky. But in these stories, not literary critics, but people who have been strongly influenced by Brodsky, whom they have never seen, there are so many of themselves that a portrait of an entire generation has come out. Generations of Joseph Brodsky's children who had never seen their father with their own eyes in their lives.",10.0,1,0.0071,ru
696052,"Goodbye, Gulsary!",2008-08-27,"Tanabay is a proud Kazakh war hero and loyal Communist who is pressured into taking a position as a herdsman in a collective farm in the Stalinist era after WWII. The pride and joy of the collective is a beautiful stallion named Gulsary. After Gulsary wins a race, the new commissar of the collective lays claim to the beloved and headstrong horse, which leads to a battle of a wills. Tanabay and Gulsary are both punished and separated for their refusal to bend to the rules of the Stalinist era.",1.0,1,0.1993,kk
248394,Big Secret For A Small Company,1979-01-05,"How a dog, a horse and a cat became friends.",6.0,3,0.1585,ru
459669,Day of Thunder,1990-04-01,Day of Thunder is a Hong Kong Crime Drama starring Alex Man.,9.0,1,0.1408,cn
330787,Huria,1986-01-02,Directed by Sid Ali Mazif.,8.0,2,0.0596,ar
226767,Amy's Torch,2008-06-10,Amy keeps the monster under her bed away at night with her magic torch but one night the batteries run out.,5.0,3,0.0168,en
108748,Little Red Riding Hood and Tom Thumb vs. the Monsters,1962-09-20,"The film follows adventures of Little Red Riding Hood (Maria Gracia) and Tom Thumb (Cesaro Quezadas) and their friends, fighting against the wicked Witch Queen (Ofelia Guilmáin) and her band of monsters.  The film starts at the meeting of the evil monsters in the castle in the Haunted Forest, heart of the Devil's dominion, during which the Vampire (Quintín Bulnes) accuses the Wolf (Manuel Valdés) and the Ogre (José Elías Moreno) of betraying the Witch Queen (La Reina Bruja, renamed Queen of Badness in the English dub), who orders them to ber executed. Their friend Stinky the Skunk (Santanón) however escapes and informs Little Red Riding Hood and Tom Thumb, who promise to help. Meanwhile, the Queen and her sister the Old Witch cast a terrible curse, turning villagers into monkeys and mice for trying to defy her magic. The rest of the story details the heroes' quest to conquer evil.",3.4,14,0.1181,es
508979,BIdentity Crisis,2011-06-08,Phil says he is bisexual but his girlfriend Helen and the flamboyant waiter think otherwise.,1.0,1,0.0214,en
244534,Happy Christmas,2014-07-25,"After a breakup with her boyfriend, a young woman moves in with her older brother, his wife, and their 2-year-old son.",5.1,162,0.3819,en
933603,Autobiografia erotica,2018-04-17,"Aristide and Mariella see each other again after 20 years in an apartment in Rome. They're not friends, rather two strangers that met once for a few hours and had a rushed sexual encounter. They start a game in which they relive and analyze their first encounter, comparing two very different sexual experiences, searching for common ground.",6.0,1,0.1257,it
329054,Colette,1951-03-31,"In conversation, in her Paris apartment, Sidonie-Gabrielle Colette, mime, dancer, novelist, wonders whether she should give the green light to a proposed film about the houses in which she lived. “I’m no longer photogenic,” she insists; nearly 80, marriages, affair with a stepson and intermittent lesbianism behind her, refusing now even to mention the arthritis that confines and assaults her, Colette is vivacious. Yannick Bellon’s captivating postmodernist film, as much a study of evanescence as any poem by Dickinson, segues into the film that Colette, a few years before her end, has just said she doesn’t want to do. Giving voice(over) to her own commentary, she goes back, first, to the home in Saint-Sauveur-en-Puisaye, Yonne, where she was born.",6.3,3,0.1057,en
457660,Cariocas,2014-05-14,"A voyeuristic hunt during a trip to Rio de Janeiro with lots of sea, sun, sweat and personal encounters. Brazilian men care about their physique and they freely allow admiration of their sculpted bodies. The sensuality of those men creates blurry sexual identities. An outdoors gym in the Arpoador area unveiled to me the vibrancy of the country and the diversity of men.",3.0,3,0.1399,pt
62777,Foo Fighters - Wasting Light Live From 606,2011-04-05,"The band began recording their seventh studio album in August 2010 with producer Butch Vig, who had previously produced the two new tracks for the band's Greatest Hits album. The album was recorded in Dave Grohl's garage using only analog equipment. A documentary on the band's history, Back and Forth, was released theatrically on April 5 along with a live 3-d performance of the album Wasting Light. While most theaters viewed the show in its entirety, some theaters had technical issues and the band rescheduled to have Back And Forth played on April 14, 2011. On April 13, 2011, the band performed the entire album live from Dave Grohl's Studio 606 and uploaded it to YouTube in its entirety.",7.0,1,0.061,en
265520,Twa-Tiu-Tiann,2014-01-30,"Through a famous painting ""South Street Festival"", a Taiwanese college boy unexpectedly travels 100 years back in time, back to the 1920's, when Taiwan was under Japanese rule. He is stuck, he panics, he wants to return to 2014 but soon changes his mind, not just because of the prettiest geisha girl in town...",2.6,5,0.3847,zh
346645,Lucent,2014-10-17,"Through a combination of hand-held and hidden camera footage, Lucent explores the darker side of Australia's pig farming industry, highlighting the day-to-day cruelty accepted by the industry as standard practice.",9.5,3,0.1166,en
36566,Cheech & Chong's Hey Watch This,2010-04-20,"A documentary based on Cheech and Chong's ""Light Up America"" reunion tour.",5.9,19,0.3256,en
139433,No One Dies in Lily Dale,2011-01-01,"A candid portrayal of Lily Dale, a spiritualist community in upstate New York, where most of the town's residents are registered Mediums who regularly give spiritual readings to visitors through alleged communication with the deceased.",2.75,4,0.1519,en
222208,NWA WrestleWar '90: Wild Thing,1990-02-25,"WrestleWar 1990: Wild Thing took place on February 25, 1990 from the Greensboro Coliseum in Greensboro, North Carolina.  The main event was for the NWA World Heavyweight Championship between Lex Luger and defending champ Ric Flair. The Steiner Brothers defended the NWA World Tag Team Champions against Arn and Ole Anderson, The Road Warriors competed against the The Skyscrapers, The Rock 'n' Roll Express competed against The Midnight Express, Norman the Lunatic fought Cactus Jack, and The Freebirds wrestled Brian Pillman and Tom Zenk in defense of the NWA US Tag Team Championships.",7.8,2,0.1041,en
190059,Stand and Deliver,1928-02-18,"Our heroine, Miss Velez (despite the fact that she seems to be just along for the ride) is much her usual over-eloquent self (how fortunate she has no sound track!), while Warner Oland makes such an impressive and villainously seedy bandit, he needs no sound track at all. We can just imagine his oily, purring accents all too well.",5.8,4,0.1832,en
505957,Material urbà,1987-12-11,,2.0,1,0.1407,ca
61645,First Love,1939-11-10,"In this reworking of Cinderella, orphaned Connie Harding is sent to live with her rich aunt and uncle after graduating from boarding school. She's hardly received with open arms, especially by her snobby cousin Barbara. When the entire family is invited to a major social ball, Barbara sees to it that Connie is forced to stay home. With the aid of her uncle, who acts as her fairy godfather, Connie makes it to the ball and meets her Prince Charming in Ted Drake, her cousin's boyfriend.",7.769,13,0.5307,en
497300,Pier Paolo Pasolini: A Film Maker's Life,1971-06-01,"Documentary about Italian movie director Pier Paolo Pasolini, with interviews with some of his actors and friends.",4.5,2,0.2071,en
420506,Shourya,2016-03-04,"Shourya (Manoj) completes his studies in the renowned Harvard University but comes to India to lead a life of a teacher. He helps the needy people. One chance meeting with Netra (Regina), a MP's daughter, turns into friendship and love blossoms. One day, they head to Kotilingala to do the jagaranam (staying awake at the night) in the temple. Late in the night, Netra's throat is slit by some unknown persons and immediately they take her to the hospital. Naturally Shourya becomes the suspect. What really happened? Who did this? Or has Shourya slit her throat as the police believe?  Shourya (Manchu Manoj) is a highly educated individual who is in deep love with Nethra (Regina Cassendra). Due to unknown reasons, the couple decide to elope but an unfortunate series of events lead to Nethra being murdered. Twist in the tale arises when Shourya gets framed for the murder.",4.5,2,0.6824,te
219163,Hofi tükre No.6,2007-12-27,,9.5,1,0.0071,hu
759934,Fred,2017-08-19,"A meet-the-parents story, with a slight twist.",1.0,1,0.0322,en
117491,Giraffes,2001-09-01,"Efrat, Dafna and Abigail are three young women who are neighbors in Tel Aviv, Israel. One night the will of their own destiny. A taxi driver picks Abigail accidentally mistaking Dafna and leads to a feature film. A Dafna, also mistakenly comes for the blind date of Efrat and spend a romantic night with this guy. Efrat, meanwhile, is involved in an investigation. Nothing will be as before.",5.0,1,0.0753,he
575026,Crazy Like a Fox,2004-10-25,"This is the story of Nat Banks, an 8th generation Virginian gentleman farmer living in the past, who loses his family farm, Greenwood, to a pair of land speculators from Washington, D.C. When the predatory couple manipulates a ""legal"" real estate transaction that turns into a hostile possession of the manor house, he temporarily loses his mind, leaving his family but not the farm. Instead he hides out in a cave on Goose Creek, waging guerilla warfare against expansionism and the destruction of historic property with the help of his family, friends, and neighbors...",4.0,1,0.1471,en
264735,The Christ of the Ocean,1971-05-03,"The people of a fishing village is about to witness a miracle thanks to the new mysterious friend of a young, lonely boy.",5.0,11,0.2938,es
651031,Kidsongs: Let's Put On A Show!,1995-04-18,"The fun begins when the Kidsongs Kids and the Biggles decide to put on a show for their dad's birthday! Join them as they rehearse, dress up in fabulous costumes and dance, dance, dance! A young magician amazes the crowd, the boys put on their blue suede shoes for an Elvis routine and the girls show off their tap dancing skills. It's toe-tapping sing-along fun from the beginning until the curtain goes down!",9.0,1,0.0,en
332049,A File in Vice,1986-06-07,"Said the officer in Vice Squad is shocked by the decision of his boss to stop the investigation into the case of Alia Hanim because of her connections with officials and turns into a rigid person. When Said has information that some women visit a flat and practice fornication , he tries to prove the charge against them even by falsification.",7.3,3,0.2226,ar
38189,The Follow,2001-05-24,"The Driver is hired by a nervous movie manager to spy on a paranoid actor's wife. During his tailing of the wife, the Driver describes the right way to tail someone. As he follows her he begins to fear what he might learn of her apparently tragic life. He discovers the wife is fleeing the country and returning to her mother's, and that she's been given a black eye, likely by her husband. He returns the money for the job, refusing to tell where the wife is, and drives off telling the manager never to call him again.",6.831,80,0.3453,en
80887,Katatonia: Live Consternation,2007-05-28,"Live Consternation is a live album and video by Swedish heavy metal band Katatonia, released in both CD and DVD format through Peaceville Records on 28 May 2007. The album features a live performance recorded at Germany's Summer Breeze Open Air festival on 17 August 2006. The artwork was designed by Travis Smith and closes the visual concept for The Great Cold Distance.",7.0,1,0.0143,en
189692,Two Days,1932-11-27,"The story concentrates on a single 48-hour period during the Russian Revolution. The central character, played by Y. E. Samchykovski, is an old servant who staunchly supports the Royal Family. Even when his master is placed in prison and his son is appointed a commissar, the servant remains faithful to the Czarist regime. But when his village is invaded by the White Russian army and his son is summarily executed, the old man realizes that his homeland is far better off in the hands of the revolutionaries, who seek to build rather than destroy. A ""cleansing"" fire brings this propaganda piece to an appropriately symbolic conclusion.",5.0,8,0.0214,uk
510849,Watchtower Over Tomorrow,1945-03-29,Short documentary film about the Dumbarton Oaks plan and the proposed formation of the United Nations.,5.0,4,0.1535,en
572872,Puķu Ansis,1968-01-15,,7.0,1,0.0143,lv
292370,NXT TakeOver: Fatal 4-Way,2014-09-11,"NXT Takeover: Fatal 4-Way took place on September 11, 2014. WWE had also advertised for KENTA's debut at the event. KENTA changed his name to Hideo Itami during his debut.",7.9,8,0.1693,en
801454,OCD,2015-05-27,A man suffering from obsessive–compulsive disorder is stalked by a menacing doppelgänger.,4.0,1,0.0694,en
254335,Young Man Falling,2007-09-27,"A 17-year-old boy is living on the fringe of a true perception of reality. Cars pursue him, while a world full of rules and systems asks for his attention. How can he concentrate on his preparations for his french exam when the stuffed animals in his room begin to interfere? And what about Irene who disturbs with her invitations?",5.0,1,0.0898,en
527970,Augur,2018-06-05,"During a harsh winter, a river by the house of two cousins freezes over. In the cold wind, their relationship grows bitter, reaching its limits.",8.5,2,0.0546,pt
102145,The Tanks of El Alamein,1957-09-19,Italian move on the battle of El Alamein,4.4,4,0.3325,it
657327,The Golden Hour,2014-09-13,Two lovers chase the last hour of light as it blooms and fades. He is losing himself and she is the keeper of his memory. There is no time. There is all the time in the world.,6.0,1,0.0143,en
884209,Die Legende von Derdriu und Noisi,2009-04-02,,6.0,1,0.0,de
215026,A Tale of Youth at Hirosaki High School,1992-01-01,"A semi-autobiographical film about a young man from Tokyo who moves to Hirosaki in the early Shōwa era. A straight-to-video production made for the Hirosaki Senior High School Alumni Association that also incorporates footage from contemporary Hirosaki, and features cameos by regular Suzuki performers like Tamagawa Isao and Nogawa Yumiko.",4.0,1,0.0636,ja
570736,The Day After I'm Gone,2020-02-13,"Yoram, a 50-year-old veterinarian living in Tel-Aviv, is forced to re-examine his relationship with his adolescent daughter Roni, after she wishes to end her life. He decides to take her on a journey to visit her mother’s family, a process of self and mutual discovery in a primordial desert land enveloping the Dead Sea.",6.6,18,0.3975,he
28444,Beyond Terror,1980-01-01,"After a drug-fueled night of  violence, a group of young degenerates and their hostages find themselves stranded in a remote, abandoned church in rural Spain. Their evening of debauchery and blasphemy quickly turns to greed when they discover a local legend that tells of a vast fortune guarded by mummies in the catacombs beneath the ruins. Their lust for the treasure is short-lived as they find that the supernatural horror in the catacombs is something further than fear… it is Beyond Terror!",4.5,12,0.1818,es
58727,Undoing,2007-12-05,"A crime drama set in LA's Koreatown, UNDOING introduces us to Samuel, who returns after a mysterious absence to reconcile the death of his best friend exactly one year ago.",3.5,2,0.2034,en
807158,Irul,2021-04-02,"A dark rainy night, an empty house, a stranded couple and an unknown man. A sleek game of the cat and the mouse starts playing on, as the three of them find a dead body in the basement.",5.6,29,0.7695,ml
90164,The Green Inferno,1988-05-01,Four friends head into the jungle to locate a lost professor but instead face off against treasure hunters who are torturing and killing natives.,5.262,42,1.7031,it
597663,Casey the Co-Ed 2,2006-01-01,"Yet another sexy romp set on the beaches of paradise. Unable to keep her crush on neighbor Billy to herself, undergrad Casey spills the beans to her girlfriends. Eager to take things to next level, Casey decides to risk it all by sending Billy and his friends on a surprise all-expenses-paid trip to the Bahamas. Little do Billy and his buddies know that Casey and her equally flirtatious pals will be waiting for them there.",2.0,1,0.2609,en
225874,The John Cena Experience,2011-06-04,"This title contains a selection of John Cena's greatest matches, as well as a documentary about his life that concentrates on his intense preparation for Wrestlemania. Included are classic battles against Edge and Great Khali, as well as a triple-threat match against Kurt Angle and Shawn Michaels. ~ Perry Seibert, Rovi",7.8,14,0.3923,en
94522,Suds,1920-01-27,"Amanda Afflick is a lovesick laundress who daydreams about customer Horace Greensmith and cherishes the shirt he brought in for washing eight months and sixteen days ago. She tells her fellow workers that the garment belongs to her fiancé, a lord. Just wait, Amanda boasts, one day his lordship will return for his wash — and for her.",6.5,8,0.2961,en
557982,Nerves for Victory,1966-08-26,A young yakuza who respects obligation and humanity must face cruel and heartless turf wars leading to a fight to the death with his own brother.,6.0,1,0.1133,ja
194581,Défilé de la garde nationale du district de Columbia,1897-03-05,"Officers and soldiers, followed by a military band, parade in front of decorated grandstands.",4.2,6,0.0214,fr
186655,The Grand Passion,1970-01-01,Polly Kuan and her brother (Pai Ying) are safeguarding a list of rebels from the villainous Jin dynasty.,5.5,2,0.0214,zh
283245,The Fall of the Male Empire,2013-03-08,"After a visit to the Natural History Museum in Paris, Simon Esich is convinced that a prehistoric man has escaped from the Evolution Gallery and is meddling in his life as a modern male. He realizes that this life coach of a new type could help him regain his lost virility and win back his wife Camille, who is becoming increasingly distant since a recent promotion and the appearance of Antoine, a handsome hunk with a devastating smile.",7.0,1,0.0338,fr
393514,Frou-frou del Tabarin,1976-01-01,Misadventures of a mother (Carmen Scarpitta) and a her daugther (Martine Brochard),6.2,2,0.0606,it
295643,"The Mystery of Agatha Christie, With David Suchet",2013-03-17,"David Suchet, TV's Poirot, has spent more of his life acting out the plots and dramas created by Agatha Christie than anyone else in the world. Suchet is embarking on a journey to learn more about the woman who created Poirot and whose books remain outsold only by Shakespeare and the Bible. Suchet's journey takes him to the places Christie lived, the landscapes that inspired her and to meetings with people who knew the woman behind the fame and those inspired by her extraordinary legacy. He explores the close links between Christie's extraordinary life and her work and discovers what it was about the woman from a small seaside town that allowed her to become the best-selling murder mystery writer in history.",7.5,4,0.0713,en
492868,Brahma.com,2017-12-15,The lives of two brothers become a mess when their identities get swapped due to a supernatural power.,6.5,2,0.1192,ta
398484,Vuelve el Norteño,1964-01-03,Two rival gangs of outlaws are terrorizing a small town; el Comandante and his sidekicks pit them against each other and pick up the pieces.,5.0,3,0.0923,en
628718,If Only I Knew...,1993-03-07,"The plague of civil war reached a provincial town, where several noble families were stuck waiting for a train. The joy of hope was replaced by despair, fear of the future. No one knew how much was allotted to him in this life.  Emotions boil, passions run high, hearts break, will is destroyed, pride is trampled. Each of the heroes survives in his own way, but all fell low. Ah, if you only knew when the long-awaited train would arrive in Moscow ...",2.0,1,0.0972,ru
661957,Joe Hisaishi Symphonic Concert: Music from the Studio Ghibli Films of Hayao Miyazaki,2017-09-06,"The music of iconic Studio Ghibli films featuring Joe Hisaishi’s celebrated scores will be performed live by the Paris-based symphony orchestra and choir Orchestre et Chœur Lamoureux at two concerts in June 2017 at the Palais des Congrès de Paris. With its international premiere, JOE HISAISHI SYMPHONIC CONCERT: MUSIC FROM THE STUDIO GHIBLI FILMS OF HAYAO MIYAZAKI explores the collaborative relationship between music and storytelling, blending music and visuals to celebrate the long partnership between Joe Hisaishi and Academy Award-winner Hayao Miyazaki (2002 Animated Feature Film for Spirited Away and 2014 Honorary Award).",10.0,1,0.1228,ja
601881,My Korean Cinema,2002-01-01,"A personal and subjective video essay series on the Korean cinema, consisting of 9 episodes. Its episodes include fragments of memory about Korean films and their ‘field’, actual moments of what is happening here and now, and images excerpted from Korean films.  [Ep 1] My Chungmuro (2002) [Ep 2] For March of Fools (2003) [Ep 3] Smoking Women (2003) [Ep 4] Kino 99 (2003) [Ep 5] Song of Keumsoon (2004) [Ep 6] The Creative Restoration of ‘An Empty Dream’ (2005) [Ep 7] Reflection on Kim Gu (2005)  [Ep 8] Garibong, Again (2006) [Ep 9] A Short Film about Pre-1945 Korean Cinema (2006)",8.0,1,0.0718,ko
494791,A Murder in Mansfield,2017-11-12,"Oscar®-winning filmmaker Barbara Kopple explores the legacy of the 1989 murder of Noreen Boyle in Mansfield, Ohio. Her 12-year-old son Collier gave a devastating videotaped testimony blaming his father for the murder. Now, over two decades later, Collier returns to Ohio seeking to retrace his past and confront his imprisoned father, who remains in denial of his guilt. Collier’s depth of character is a wonder to behold from childhood to adulthood. Out of this tragic story, we witness the power of human resilience.",7.2,6,0.1504,en
675607,The Ghost falls in Love,1953-06-26,A romance between a woman and a ghost.,5.0,2,0.0953,es
183324,A Camp Smithy,1899-01-01,,3.5,2,0.0143,en
534533,Psychology of the Orgasm,1970-09-18,Docu-fiction about young people talking about their sex life.,5.0,4,0.1021,de
64046,The Secret of Queen Anna or Musketeers 30 Years Later,1993-06-06,"The 3rd part of the famous trilogy by Alexandre Dumas about d'Artagnan and his 3 friends Athos, Porthos and Aramis.",4.1,9,0.14,ru
68752,Judgment in Berlin,1988-05-06,An American judge in Germany must decide if the hijacking of an East German plane into West Berlin was justified.,5.4,13,0.5476,en
67487,Strikeforce World Grand Prix Quarter-Finals: Overeem vs. Werdum,2011-06-18,"Strikeforce World Grand Prix Quarter-Finals: Overeem vs. Werdum, also known as Strikeforce: Dallas, was a mixed martial arts event held by Strikeforce. The event took place on June 18, 2011 at the American Airlines Center in Dallas, Texas. The main card aired on Showtime while the preliminary card aired on HDNet.",5.5,3,0.0513,en
